video_id,title,human_label,promise_text,transcript_path,summary_path,speech_coverage_percent,semantic_divergence,summary_source,usable_for_training,hook_promise_source,hook_ocr_usable,from_spike
tVQSxFDbEfg,"ত্রিপক্ষীয় চুক্তি সই,  সময় লাগবে ৩ মাস || Sinopharm Vaccine || Incepta Pharma",non_clickbait,"ত্রিপক্ষীয় চুক্তি সই,  সময় লাগবে ৩ মাস || Sinopharm Vaccine || Incepta Pharma",data/transcripts/tVQSxFDbEfg\raw_transcript.txt,data/transcripts/tVQSxFDbEfg\summary.txt,79.3,0.5382232069969177,gemini,True,title,False,False
5D8IknGiwzU,করোনা টিকা নিয়েছেন  বিএনপি চেয়ারপারসন খালেদা জিয়া || Khaleda Zia,non_clickbait,করোনা টিকা নিয়েছেন  বিএনপি চেয়ারপারসন খালেদা জিয়া || Khaleda Zia,data/transcripts/5D8IknGiwzU\raw_transcript.txt,data/transcripts/5D8IknGiwzU\summary.txt,81.89,0.3862963914871216,gemini,True,title,False,False
GyeiHbR91rs,হায় সর্বনাশ! চোখের পলকে বজ্রপাতে মারা গেল ২১ জন। বজ্রপাত থেকে বাঁচতে চাইলে ভিডিওটি একবার দেখুন,clickbait,"হায় সর্বনাশ! চোখের পলকে বজ্রপাতে মারা গেল ২১ জন। বজ্রপাত থেকে বাঁচতে চাইলে ভিডিওটি একবার দেখুন
বেলি নিটচ",data/transcripts/GyeiHbR91rs\raw_transcript.txt,data/transcripts/GyeiHbR91rs\summary.txt,95.58,0.3787402510643005,gemini,True,title+ocr,True,False
PTMKz3W0kmY,২৯ মে ইস্তানবুলে চেলসি-ম্যানচেস্টার সিটি শিরোপা লড়াই || Manchester City vs Chelsea,non_clickbait,২৯ মে ইস্তানবুলে চেলসি-ম্যানচেস্টার সিটি শিরোপা লড়াই || Manchester City vs Chelsea,data/transcripts/PTMKz3W0kmY\raw_transcript.txt,data/transcripts/PTMKz3W0kmY\summary.txt,85.63,0.399401307106018,gemini,True,title,False,False
1M0kK5Eh6bo,লজ্জাস্থানে বর্শা মেরে নির্মম ভাবে শহীদ করা হয়েছিল সুমাইয়া(রাঃ)কে।ইসলামের জন্য জীবন দেওয়া প্রথম নারী,clickbait,লজ্জাস্থানে বর্শা মেরে নির্মম ভাবে শহীদ করা হয়েছিল সুমাইয়া(রাঃ)কে।ইসলামের জন্য জীবন দেওয়া প্রথম নারী,data/transcripts/1M0kK5Eh6bo\raw_transcript.txt,data/transcripts/1M0kK5Eh6bo\summary.txt,89.04,0.1944977641105651,gemini,True,title,False,False
mE1xKftUkV4,দেখে নিন জাতীয় নির্বাচনে মনোনয়ন পাচ্ছে যে নায়ক/নায়িকা ও তারকারা ।। getting nomination election,clickbait,দেখে নিন জাতীয় নির্বাচনে মনোনয়ন পাচ্ছে যে নায়ক/নায়িকা ও তারকারা ।। getting nomination election,data/transcripts/mE1xKftUkV4\raw_transcript.txt,data/transcripts/mE1xKftUkV4\summary.txt,80.31,0.3071264624595642,gemini,True,title,False,False
8IViSa77QkI,ফাঁসি চাই অমানুষ চেয়ারম্যানের! লাকসাম মাহফিলে বক্তাকে মারার হুমকি দেয়া! সেই অমানুষের কঠিন বিচার শুরু,clickbait,ফাঁসি চাই অমানুষ চেয়ারম্যানের! লাকসাম মাহফিলে বক্তাকে মারার হুমকি দেয়া! সেই অমানুষের কঠিন বিচার শুরু,data/transcripts/8IViSa77QkI\raw_transcript.txt,data/transcripts/8IViSa77QkI\summary.txt,96.14,0.3364036083221435,gemini,True,title,False,False
sIiH7gNOL_M,ব্রেকিং! সেনাবাহিনী পাঠিয়ে বাংলাদেশ দখলের হুমকি দিলো ভারত! ট্রাম্প না জিতলে যুদ্ধ লেগে যাবে আমেরিকায়,clickbait,ব্রেকিং! সেনাবাহিনী পাঠিয়ে বাংলাদেশ দখলের হুমকি দিলো ভারত! ট্রাম্প না জিতলে যুদ্ধ লেগে যাবে আমেরিকায়,data/transcripts/sIiH7gNOL_M\raw_transcript.txt,data/transcripts/sIiH7gNOL_M\summary.txt,96.12,0.3722639083862304,gemini,True,title,False,False
yHTJKlI7l2Q,পৃথিবীর সবচেয়ে গরিব ৫টি দেশ। যেখানে না খেয়ে মারা যায় বেশিরভাগ মানুষ। Top 5 Poorest Countries,clickbait,পৃথিবীর সবচেয়ে গরিব ৫টি দেশ। যেখানে না খেয়ে মারা যায় বেশিরভাগ মানুষ। Top 5 Poorest Countries,data/transcripts/yHTJKlI7l2Q\raw_transcript.txt,data/transcripts/yHTJKlI7l2Q\summary.txt,83.42,0.3243115544319153,gemini,True,title,False,False
mVOL-iUF3_E,বৃহস্পতিবার গভীর রাতে নাইজেরিয়ায় এই ঘটনা ঘটে || #Nigeria incident,non_clickbait,বৃহস্পতিবার গভীর রাতে নাইজেরিয়ায় এই ঘটনা ঘটে || #Nigeria incident,data/transcripts/mVOL-iUF3_E\raw_transcript.txt,data/transcripts/mVOL-iUF3_E\summary.txt,68.2,0.4541811347007751,gemini,True,title,False,False
cLMflTcfaSs,করোনার আঘাতে ভারতের অর্থনীতিতে ক্ষতির আশঙ্কা || India Economy || RBI,non_clickbait,করোনার আঘাতে ভারতের অর্থনীতিতে ক্ষতির আশঙ্কা || India Economy || RBI,data/transcripts/cLMflTcfaSs\raw_transcript.txt,data/transcripts/cLMflTcfaSs\summary.txt,66.73,0.4333822727203369,gemini,True,title,False,False
zyUa-syYEF0,"বাঁ হাতে চোট পেলেন মুশি, ছিটকে গেলেন ডিপিএল থেকে ।। Mushfiqur Rahim",non_clickbait,"বাঁ হাতে চোট পেলেন মুশি, ছিটকে গেলেন ডিপিএল থেকে ।। Mushfiqur Rahim",data/transcripts/zyUa-syYEF0\raw_transcript.txt,data/transcripts/zyUa-syYEF0\summary.txt,62.29,0.4470882415771484,gemini,True,title,False,False
dAXiERAvSMw,৭ হাজারের বেশি মানুষের মৃত্যু হয়েছে ||  World Corona,non_clickbait,৭ হাজারের বেশি মানুষের মৃত্যু হয়েছে ||  World Corona,data/transcripts/dAXiERAvSMw\raw_transcript.txt,data/transcripts/dAXiERAvSMw\summary.txt,79.88,0.4895992279052734,gemini,True,title,False,False
j6_rGkwlvQc,গরম খবর! ফাঁসি হচ্ছে সাহেদ সাবরিনার! কোন ভাবেই রক্ষা পাচ্ছেনা দুই নাটের গুরু। | Shahed | Sabrina,clickbait,গরম খবর! ফাঁসি হচ্ছে সাহেদ সাবরিনার! কোন ভাবেই রক্ষা পাচ্ছেনা দুই নাটের গুরু। | Shahed | Sabrina,data/transcripts/j6_rGkwlvQc\raw_transcript.txt,data/transcripts/j6_rGkwlvQc\summary.txt,97.0,0.4523208141326904,gemini,True,title,False,False
UWqcEWe_sDg,শান্তিতে নোবেল পুরস্কার পাবে শেখ হাসিনা ! সত্যিই কি পাবে ? । রোহিঙ্গা ইস্যুতে মানবিকতার জন্য ...,clickbait,শান্তিতে নোবেল পুরস্কার পাবে শেখ হাসিনা ! সত্যিই কি পাবে ? । রোহিঙ্গা ইস্যুতে মানবিকতার জন্য ...,data/transcripts/UWqcEWe_sDg\raw_transcript.txt,data/transcripts/UWqcEWe_sDg\summary.txt,81.13,0.3000079393386841,gemini,True,title,False,False
N3If0m50BZA,গত ২৪ ঘণ্টায় করোনা শনাক্তের সংখ্যা বেড়েছে || BD CORONA,non_clickbait,গত ২৪ ঘণ্টায় করোনা শনাক্তের সংখ্যা বেড়েছে || BD CORONA,data/transcripts/N3If0m50BZA\raw_transcript.txt,data/transcripts/N3If0m50BZA\summary.txt,77.64,0.3610953092575073,gemini,True,title,False,False
SBp2K8wYAzQ,"পাঁচশো টিকটিক আইডি- গ্রুপ, হোয়াটসঅ্যাপ ও ফেসবুক আইডি শনাক্ত || #Tiktok Ridoy Group",non_clickbait,"পাঁচশো টিকটিক আইডি- গ্রুপ, হোয়াটসঅ্যাপ ও ফেসবুক আইডি শনাক্ত || #Tiktok Ridoy Group",data/transcripts/SBp2K8wYAzQ\raw_transcript.txt,data/transcripts/SBp2K8wYAzQ\summary.txt,85.54,0.3492516875267029,gemini,True,title,False,False
GuciYLEYMR8,কোভিড হাসপাতালে ভারতীয় ভ্যারিয়েন্টের ২ জন রোগী শনাক্ত || DNCC indian corona,non_clickbait,"কোভিড হাসপাতালে ভারতীয় ভ্যারিয়েন্টের ২ জন রোগী শনাক্ত || DNCC indian corona
শুভঙ্চ 5][[5 টাঙ্কা",data/transcripts/GuciYLEYMR8\raw_transcript.txt,data/transcripts/GuciYLEYMR8\summary.txt,69.49,0.334024965763092,gemini,True,title+ocr,True,False
gxEJf6-Dg_Q,টিকটক গ্রুপকে কেন্দ্র করে দেশে একটি আন্তর্জাতিক নারী পাচার চক্র সক্রিয় ।। Tiktok Syndicate,non_clickbait,"টিকটক গ্রুপকে কেন্দ্র করে দেশে একটি আন্তর্জাতিক নারী পাচার চক্র সক্রিয় ।। Tiktok Syndicate
0৩9 লাইনে দডি নংবাচ",data/transcripts/gxEJf6-Dg_Q\raw_transcript.txt,data/transcripts/gxEJf6-Dg_Q\summary.txt,79.04,0.3166934251785278,gemini,True,title+ocr,True,False
b-QOJ1vPB0M,হাসপাতাল ও অক্সিজেন সরবরাহ এখন থেকে প্রস্তুত রাখার পরামর্শ বিশেষজ্ঞদের || [BD Covid19 Situation],non_clickbait,"হাসপাতাল ও অক্সিজেন সরবরাহ এখন থেকে প্রস্তুত রাখার পরামর্শ বিশেষজ্ঞদের || [BD Covid19 Situation]
পিন সেট করলেই নগদ এ",data/transcripts/b-QOJ1vPB0M\raw_transcript.txt,data/transcripts/b-QOJ1vPB0M\summary.txt,81.98,0.3271243572235107,gemini,True,title+ocr,True,False
yRAS-3_kOZ4,এই মাত্র পাওয়া! বিচার না পাওয়া পর্যন্ত! রাত দিন রাস্তায় ই থাকবে কাদের মির্জা। আ.লীগ নেতাকে হুশিয়ারী,clickbait,"এই মাত্র পাওয়া! বিচার না পাওয়া পর্যন্ত! রাত দিন রাস্তায় ই থাকবে কাদের মির্জা। আ.লীগ নেতাকে হুশিয়ারী
দসতেচে আগমমৌলীগের সমগারব সঙ্গযলক চোদুণী 483 শেংম্পানীগচ গানা সেহমসী; মুড্যেখ চূগকেন বাহনীর পরশিণাদরত বীর মুক্তিযোদ্দা শুবায়দুল ককাদেল্ন সাহেব কেঁ দিয়ে মিধ্যা কটুক্তিল প্র্তিবালে বমঢদিল দম",data/transcripts/yRAS-3_kOZ4\raw_transcript.txt,data/transcripts/yRAS-3_kOZ4\summary.txt,96.5,0.1814271211624145,gemini,True,title+ocr,True,False
BMxBsqfyMTs,"দুই দফা বৃষ্টিতে পানির নিচে ঢাকা, দুর্ভোগে রাজধানীবাসী ।। Dhaka",non_clickbait,"দুই দফা বৃষ্টিতে পানির নিচে ঢাকা, দুর্ভোগে রাজধানীবাসী ।। Dhaka",data/transcripts/BMxBsqfyMTs\raw_transcript.txt,data/transcripts/BMxBsqfyMTs\summary.txt,53.64,0.415908932685852,gemini,True,title,False,False
77jl0bnn9F4,হায় হায়! এক থ্রি-পিস বিক্রি করে উল্টো জরিমানা গুনলেন ২ লাখ ৩০ হাজার টাকা! কাপড় কিনে প্রেমের ফাঁদ!,clickbait,হায় হায়! এক থ্রি-পিস বিক্রি করে উল্টো জরিমানা গুনলেন ২ লাখ ৩০ হাজার টাকা! কাপড় কিনে প্রেমের ফাঁদ!,data/transcripts/77jl0bnn9F4\raw_transcript.txt,data/transcripts/77jl0bnn9F4\summary.txt,95.02,0.4090632796287536,gemini,True,title,False,False
mPB6_Wo25vk,দুবাইয়ে ডান্সের আড়ালে দেহ ব্যবসা করছে দেড় হাজার বাংলাদেশি মেয়ে। ইজ্জত সব শেষ। Bangladeshi Girl Dubai,clickbait,দুবাইয়ে ডান্সের আড়ালে দেহ ব্যবসা করছে দেড় হাজার বাংলাদেশি মেয়ে। ইজ্জত সব শেষ। Bangladeshi Girl Dubai,data/transcripts/mPB6_Wo25vk\raw_transcript.txt,data/transcripts/mPB6_Wo25vk\summary.txt,97.67,0.3795257210731506,gemini,True,title,False,False
vOWw0ZXfSDY,চাকরিবিধি ভঙ্গ করায় গোলাম সাকলায়েনের বিরুদ্ধে বিভাগীয় ব্যবস্থা || Shafiqul Islam,non_clickbait,চাকরিবিধি ভঙ্গ করায় গোলাম সাকলায়েনের বিরুদ্ধে বিভাগীয় ব্যবস্থা || Shafiqul Islam,data/transcripts/vOWw0ZXfSDY\raw_transcript.txt,data/transcripts/vOWw0ZXfSDY\summary.txt,83.28,0.2068561911582946,gemini,True,title,False,False
4k_5JH84SNo,দেশে চীনের করোনা টিকা উৎপাদনে সিনোফার্ম-ইনসেপ্টা-স্বাস্থ্য মন্ত্রণালয়ের মধ্যে চুক্তি সই || [Vaccine],non_clickbait,দেশে চীনের করোনা টিকা উৎপাদনে সিনোফার্ম-ইনসেপ্টা-স্বাস্থ্য মন্ত্রণালয়ের মধ্যে চুক্তি সই || [Vaccine],data/transcripts/4k_5JH84SNo\raw_transcript.txt,data/transcripts/4k_5JH84SNo\summary.txt,75.21,0.2542822957038879,gemini,True,title,False,False
vH7haINg6oY,সুন্দরী মেয়ের প্রেমে পড়ে ডাকাত থেকে আল্লাহর ওলি হওয়ার অলৌকিক ঘটনা|Islamic Real Miracles Story Bangla,clickbait,সুন্দরী মেয়ের প্রেমে পড়ে ডাকাত থেকে আল্লাহর ওলি হওয়ার অলৌকিক ঘটনা|Islamic Real Miracles Story Bangla,data/transcripts/vH7haINg6oY\raw_transcript.txt,data/transcripts/vH7haINg6oY\summary.txt,89.79,0.3594967126846313,gemini,True,title,False,False
EgBwSpmyZP0,এক লোক পুকুরে কুমির পুষতেন তিনি বলেন যে সাঁতরে পার হতে পারবে তাকে ১কোটি টাকা দেব। দেখুন এরপর কি হল,clickbait,এক লোক পুকুরে কুমির পুষতেন তিনি বলেন যে সাঁতরে পার হতে পারবে তাকে ১কোটি টাকা দেব। দেখুন এরপর কি হল,data/transcripts/EgBwSpmyZP0\raw_transcript.txt,data/transcripts/EgBwSpmyZP0\summary.txt,74.55,0.3161367774009704,gemini,True,title,False,False
LASC-4VgEgc,দেখুন মায়ের মত মমতা দিয়ে নিজ হাতে এতিম শিশুকে খাইয়ে দিলেন প্রধানমন্ত্রী ।। Ruposhi Bangla Tv,clickbait,দেখুন মায়ের মত মমতা দিয়ে নিজ হাতে এতিম শিশুকে খাইয়ে দিলেন প্রধানমন্ত্রী ।। Ruposhi Bangla Tv,data/transcripts/LASC-4VgEgc\raw_transcript.txt,data/transcripts/LASC-4VgEgc\summary.txt,74.28,0.4788408279418945,gemini,True,title,False,False
Og5K2PxHglc,১৯২১ সালে এই দিনে প্রতিষ্ঠিত হয় ঢাকা বিশ্ববিদ্যালয় || [Dhaka University],non_clickbait,১৯২১ সালে এই দিনে প্রতিষ্ঠিত হয় ঢাকা বিশ্ববিদ্যালয় || [Dhaka University],data/transcripts/Og5K2PxHglc\raw_transcript.txt,data/transcripts/Og5K2PxHglc\summary.txt,87.43,0.4385972023010254,gemini,True,title,False,False
5J1b2l5rwc0,হাজার হাজার কোটি টাকার মালিক যে ৪ জন বাংলাদেশী। তাদের এতই টাকা যার হিসাব রাখতে লোক আছে  ১০০ এর বেশি,clickbait,হাজার হাজার কোটি টাকার মালিক যে ৪ জন বাংলাদেশী। তাদের এতই টাকা যার হিসাব রাখতে লোক আছে  ১০০ এর বেশি,data/transcripts/5J1b2l5rwc0\raw_transcript.txt,data/transcripts/5J1b2l5rwc0\summary.txt,90.78,0.5382992625236511,gemini,True,title,False,False
rWfRRbxQDE8,"যাদের ঠেকাতে উদ্যোগ, সেই নদী-দখলদারকে বাঁচিয়েই বুড়িগঙ্গায় সীমানাখুঁটি || [Buriganga]",non_clickbait,"যাদের ঠেকাতে উদ্যোগ, সেই নদী-দখলদারকে বাঁচিয়েই বুড়িগঙ্গায় সীমানাখুঁটি || [Buriganga]",data/transcripts/rWfRRbxQDE8\raw_transcript.txt,data/transcripts/rWfRRbxQDE8\summary.txt,86.42,0.3530697226524353,gemini,True,title,False,False
dY-NNfTokvE,বেসরকারি পর্যায়ে প্রথমবারের মতো সুকুক বন্ড ছাড়ার অনুমোদন পেয়েছে বেক্সিমকো || Sukuk Bond,non_clickbait,বেসরকারি পর্যায়ে প্রথমবারের মতো সুকুক বন্ড ছাড়ার অনুমোদন পেয়েছে বেক্সিমকো || Sukuk Bond,data/transcripts/dY-NNfTokvE\raw_transcript.txt,data/transcripts/dY-NNfTokvE\summary.txt,79.5,0.2375151515007019,gemini,True,title,False,False
QLJarPiwLVc,৩৫ বছর পর বাংলাদেশি বাবাকে খুঁজে পেল ব্রিটিশ পুত্র। দেখুন সেই বাবা ছেলের আবেগঘন মুহূর্ত,clickbait,৩৫ বছর পর বাংলাদেশি বাবাকে খুঁজে পেল ব্রিটিশ পুত্র। দেখুন সেই বাবা ছেলের আবেগঘন মুহূর্ত,data/transcripts/QLJarPiwLVc\raw_transcript.txt,data/transcripts/QLJarPiwLVc\summary.txt,85.13,0.4121477603912353,gemini,True,title,False,False
n7Xtx2u2BsI,বাংলাদেশের সেরা ১০ জেলার আলোচিত ইয়াবা সুন্দরীরা। তাদের সুখ ও বিলাসীতা দেখলে পুরাই মাথা নষ্ট হয়ে যাবে,clickbait,বাংলাদেশের সেরা ১০ জেলার আলোচিত ইয়াবা সুন্দরীরা। তাদের সুখ ও বিলাসীতা দেখলে পুরাই মাথা নষ্ট হয়ে যাবে,data/transcripts/n7Xtx2u2BsI\raw_transcript.txt,data/transcripts/n7Xtx2u2BsI\summary.txt,89.4,0.3482515215873718,gemini,True,title,False,False
COw46OBh8uk,২০১০ সালের ৩ জুন পুরান ঢাকার নিমতলীতে ভয়াবহ অগ্নিকাণ্ডে প্রাণ হারাণ ১২৪ ||[Neemtoli Trazedy],non_clickbait,২০১০ সালের ৩ জুন পুরান ঢাকার নিমতলীতে ভয়াবহ অগ্নিকাণ্ডে প্রাণ হারাণ ১২৪ ||[Neemtoli Trazedy],data/transcripts/COw46OBh8uk\raw_transcript.txt,data/transcripts/COw46OBh8uk\summary.txt,80.04,0.3738052248954773,gemini,True,title,False,False
o831o2nK2e0,সর্বনাশ! মাত্র ৫ মিনিটের ঘূর্ণিঝড়ে লণ্ডভণ্ড হাজার হাজার ঘর বাড়ি। চোখের জ্বলে ভাসছে অনেক পরিবার,clickbait,সর্বনাশ! মাত্র ৫ মিনিটের ঘূর্ণিঝড়ে লণ্ডভণ্ড হাজার হাজার ঘর বাড়ি। চোখের জ্বলে ভাসছে অনেক পরিবার,data/transcripts/o831o2nK2e0\raw_transcript.txt,data/transcripts/o831o2nK2e0\summary.txt,87.35,0.2976016402244568,gemini,True,title,False,False
ZO7lyyyPZAY,নির্ধারিত সময়ে বেতন-বোনাস দিতে পারেনি অনেক গার্মেন্টস || GARMENT WORKERS,non_clickbait,নির্ধারিত সময়ে বেতন-বোনাস দিতে পারেনি অনেক গার্মেন্টস || GARMENT WORKERS,data/transcripts/ZO7lyyyPZAY\raw_transcript.txt,data/transcripts/ZO7lyyyPZAY\summary.txt,76.91,0.394711971282959,gemini,True,title,False,False
xMA2z9gL97w,৩৬ লাখ পরিবারকে আড়াই হাজার টাকা করে সহায়তা দিচ্ছেন প্রধানমন্ত্রী || Sheikh Fazle Noor Taposh,non_clickbait,৩৬ লাখ পরিবারকে আড়াই হাজার টাকা করে সহায়তা দিচ্ছেন প্রধানমন্ত্রী || Sheikh Fazle Noor Taposh,data/transcripts/xMA2z9gL97w\raw_transcript.txt,data/transcripts/xMA2z9gL97w\summary.txt,62.69,0.3940256834030151,gemini,True,title,False,False
eQsluuym2NU,এইমাত্র পাওয়া ! আল্লামা নূর হোসাইন কাসেমীর অবস্থা সংক'টাপন্ন || দোয়া ছাড়া আর কোন উপায় নেই ||,clickbait,এইমাত্র পাওয়া ! আল্লামা নূর হোসাইন কাসেমীর অবস্থা সংক'টাপন্ন || দোয়া ছাড়া আর কোন উপায় নেই ||,data/transcripts/eQsluuym2NU\raw_transcript.txt,data/transcripts/eQsluuym2NU\summary.txt,95.43,0.3053008913993835,gemini,True,title,False,False
ne_t02_2oaQ,বিশ্ববিদ্যালয়ের শিক্ষার্থীদের টিকা নিয়ে অনিশ্চয়তা || Public University,non_clickbait,বিশ্ববিদ্যালয়ের শিক্ষার্থীদের টিকা নিয়ে অনিশ্চয়তা || Public University,data/transcripts/ne_t02_2oaQ\raw_transcript.txt,data/transcripts/ne_t02_2oaQ\summary.txt,82.7,0.238229751586914,gemini,True,title,False,False
J5HtNEMxHBk,চাল পাচ্ছেন না ভিজিডি কার্ডধারী হতদরিদ্ররা  || #Kishorgonj VGD,non_clickbait,চাল পাচ্ছেন না ভিজিডি কার্ডধারী হতদরিদ্ররা  || #Kishorgonj VGD,data/transcripts/J5HtNEMxHBk\raw_transcript.txt,data/transcripts/J5HtNEMxHBk\summary.txt,80.83,0.4027522802352905,gemini,True,title,False,False
IeqXW0gA8Ks,"মোদীর পাওয়ার শেষ, খেপেছে সৌদি আরব| ভারতকে শায়েস্তা করতে যাচ্ছে ওআইসি",clickbait,"মোদীর পাওয়ার শেষ, খেপেছে সৌদি আরব| ভারতকে শায়েস্তা করতে যাচ্ছে ওআইসি",data/transcripts/IeqXW0gA8Ks\raw_transcript.txt,data/transcripts/IeqXW0gA8Ks\summary.txt,93.7,0.3655325174331665,gemini,True,title,False,False
