video_id,title,human_label,promise_text,transcript_path,summary_path,speech_coverage_percent,semantic_divergence,summary_source,usable_for_training,hook_promise_source,hook_ocr_usable,from_spike
unDUZmRvEhI,এই মাত্র পাওয়া! ভাস্কর্যের বিপক্ষে আন্দলোন চলবেই! কেউ থামাতে পারবে না হেফাজতের হুংকার।ও ক্ষেপেছে নুর,clickbait,এই মাত্র পাওয়া! ভাস্কর্যের বিপক্ষে আন্দলোন চলবেই! কেউ থামাতে পারবে না হেফাজতের হুংকার।ও ক্ষেপেছে নুর,data/transcripts/unDUZmRvEhI\raw_transcript.txt,data/transcripts/unDUZmRvEhI\summary.txt,96.55,0.3732284307479858,gemini,True,title,False,True
o_O4xdi57pQ,এই মাত্র পাওয়া! আদালতে র‌্যাবের সাথে তেরামি করে কঠিন ধোলাই খেল ইরফান! ও রক্ষা পেলনা হাজি সেলিমও,clickbait,এই মাত্র পাওয়া! আদালতে র‌্যাবের সাথে তেরামি করে কঠিন ধোলাই খেল ইরফান! ও রক্ষা পেলনা হাজি সেলিমও,data/transcripts/o_O4xdi57pQ\raw_transcript.txt,data/transcripts/o_O4xdi57pQ\summary.txt,96.0,0.4281457662582397,gemini,True,title,False,True
S88zAu6f0m4,এবার শিপ্রার আরো একটি খারাপ ভিডিও ভাইরাল। আর রক্ষা হবেনা পড়েছে কঠিন বিপদে। Just Go | Shipra | Sinha,clickbait,এবার শিপ্রার আরো একটি খারাপ ভিডিও ভাইরাল। আর রক্ষা হবেনা পড়েছে কঠিন বিপদে। Just Go | Shipra | Sinha,data/transcripts/S88zAu6f0m4\raw_transcript.txt,data/transcripts/S88zAu6f0m4\summary.txt,95.34,0.4965078234672546,gemini,True,title,False,True
0qQTzPvw_ig,এবার নাতনিকে বিয়ে করলো রাজশাহীর বুড়ো মেয়র! কুমিল্লার সেই রিক্সাচালকের বিচার হলে ওনার কি হবে না?,clickbait,এবার নাতনিকে বিয়ে করলো রাজশাহীর বুড়ো মেয়র! কুমিল্লার সেই রিক্সাচালকের বিচার হলে ওনার কি হবে না?,data/transcripts/0qQTzPvw_ig\raw_transcript.txt,data/transcripts/0qQTzPvw_ig\summary.txt,98.1,0.4283652901649475,gemini,True,title,False,True
5-1l3UcUtYI,ভয়াবহ গোপন তথ্য ফাঁস! ফেতনা সৃষ্টি করছেন আজহারী? দেখুন আলেম সমাজ কি বলছে ও চলছে পাল্টাপাল্টি অভিযোগ,clickbait,ভয়াবহ গোপন তথ্য ফাঁস! ফেতনা সৃষ্টি করছেন আজহারী? দেখুন আলেম সমাজ কি বলছে ও চলছে পাল্টাপাল্টি অভিযোগ,data/transcripts/5-1l3UcUtYI\raw_transcript.txt,data/transcripts/5-1l3UcUtYI\summary.txt,95.56,0.2539719343185425,gemini,True,title,False,True
DHaQUpweOi8,ব্রেকিং নিউজ! ২০০ গাছ লাগিয়ে ১১ কোটি টাকার দূর্নীতি! দূর্নীতিতে দেশটা শেষ! এমপি বুবলির ভয়াবহ কান্ড,clickbait,ব্রেকিং নিউজ! ২০০ গাছ লাগিয়ে ১১ কোটি টাকার দূর্নীতি! দূর্নীতিতে দেশটা শেষ! এমপি বুবলির ভয়াবহ কান্ড,data/transcripts/DHaQUpweOi8\raw_transcript.txt,data/transcripts/DHaQUpweOi8\summary.txt,96.59,0.4620310068130493,gemini,True,title,False,True
-SpHq_CW38Y,এই মাত্র পাওয়া! সব স্বীকার করে যে ভয়াবহ গোপন তথ্য দিল অনিক সরকার। একে একে বেরিয়ে আসছে সব তথ্য,clickbait,এই মাত্র পাওয়া! সব স্বীকার করে যে ভয়াবহ গোপন তথ্য দিল অনিক সরকার। একে একে বেরিয়ে আসছে সব তথ্য,data/transcripts/-SpHq_CW38Y\raw_transcript.txt,data/transcripts/-SpHq_CW38Y\summary.txt,92.09,0.2936000227928161,gemini,True,title,False,True
Cwi8KxAqaho,এক স্বার্থপর প্রেমিকার জন্য কিডনী বিক্রির বাস্তব ঘটনা। যা সারা দুনিয়ার মানুষকে স্তব্ধ করে দিয়েছিল,clickbait,"এক স্বার্থপর প্রেমিকার জন্য কিডনী বিক্রির বাস্তব ঘটনা। যা সারা দুনিয়ার মানুষকে স্তব্ধ করে দিয়েছিল
নবম-ষৌচামব: দমামেনা নঙচটব",data/transcripts/Cwi8KxAqaho\raw_transcript.txt,data/transcripts/Cwi8KxAqaho\summary.txt,86.82,0.2123790979385376,gemini,True,title+ocr,True,True
8-YmrdtPzx0,পৃথিবীর সবচেয়ে ভয়ংকর ১০টি যুদ্ধ বিমান! যা কোন দেশকে নিমিষেই শেষ করে দিতে পারে। Top 10 Fighter Jet,clickbait,পৃথিবীর সবচেয়ে ভয়ংকর ১০টি যুদ্ধ বিমান! যা কোন দেশকে নিমিষেই শেষ করে দিতে পারে। Top 10 Fighter Jet,data/transcripts/8-YmrdtPzx0\raw_transcript.txt,data/transcripts/8-YmrdtPzx0\summary.txt,91.14,0.3172768354415893,gemini,True,title,False,True
Nimw7-mZTSw,কাতারের মাথা নষ্ট করা কিছু গোপন তথ্য! যা জানলে কাতার সম্পর্কে আপনার ধারনাই পাল্টে যাবে। Facts Qatar,clickbait,কাতারের মাথা নষ্ট করা কিছু গোপন তথ্য! যা জানলে কাতার সম্পর্কে আপনার ধারনাই পাল্টে যাবে। Facts Qatar,data/transcripts/Nimw7-mZTSw\raw_transcript.txt,data/transcripts/Nimw7-mZTSw\summary.txt,89.0,0.3452956676483154,gemini,True,title,False,True
v3jHYhg3vXQ,ব্রাজিলের কিছু মাথা নষ্ট করা অদ্ভুত তথ্য। যা ব্রাজিল সম্পর্কে আপনার সব ধারণা পাল্টে দিবে।,clickbait,ব্রাজিলের কিছু মাথা নষ্ট করা অদ্ভুত তথ্য। যা ব্রাজিল সম্পর্কে আপনার সব ধারণা পাল্টে দিবে।,data/transcripts/v3jHYhg3vXQ\raw_transcript.txt,data/transcripts/v3jHYhg3vXQ\summary.txt,85.97,0.2652451395988464,gemini,True,title,False,True
U5vQZUjuQQc,আ.লীগের হয়ে নির্বাচন করবে মাশরাফি বললেন মাশরাফির বাবা। মাশরাফির এই ভুল ডিসিশনে ক্ষিপ্ত দেশবাসী,clickbait,আ.লীগের হয়ে নির্বাচন করবে মাশরাফি বললেন মাশরাফির বাবা। মাশরাফির এই ভুল ডিসিশনে ক্ষিপ্ত দেশবাসী,data/transcripts/U5vQZUjuQQc\raw_transcript.txt,data/transcripts/U5vQZUjuQQc\summary.txt,84.29,0.4158756732940674,gemini,True,title,False,True
2KxqeMDZ_AM,এবার আপন ভাতিজার সাথে পালালো ২ সন্তানের মা। দেখুন মানুষ কতটা খারাপ হলে এমন কাজ করতে পারে,clickbait,এবার আপন ভাতিজার সাথে পালালো ২ সন্তানের মা। দেখুন মানুষ কতটা খারাপ হলে এমন কাজ করতে পারে,data/transcripts/2KxqeMDZ_AM\raw_transcript.txt,data/transcripts/2KxqeMDZ_AM\summary.txt,85.99,0.4131417274475097,gemini,True,title,False,True
ppnbT5J1MWc,খুশির খবর আগামীকালই খালেদা জিয়ার জামিন হবে। বললেন মওদুদ,clickbait,খুশির খবর আগামীকালই খালেদা জিয়ার জামিন হবে। বললেন মওদুদ,data/transcripts/ppnbT5J1MWc\raw_transcript.txt,data/transcripts/ppnbT5J1MWc\summary.txt,81.81,0.3973686695098877,gemini,True,title,False,True
95vimI2OIUk,কে এই যুবক!!  অতিরিক্ত সুন্দর হওয়ার অপরাধে সৌদি আরব থেকে বের করে দিল যাকে ।। bangla exclusive info,clickbait,কে এই যুবক!!  অতিরিক্ত সুন্দর হওয়ার অপরাধে সৌদি আরব থেকে বের করে দিল যাকে ।। bangla exclusive info,data/transcripts/95vimI2OIUk\raw_transcript.txt,data/transcripts/95vimI2OIUk\summary.txt,78.61,0.4919694662094116,gemini,True,title,False,True
LwXoyvLbdMI,এই মাত্র পাওয়া খবর মালয়েশিয়া থেকে ফেরত আসতে হবে আড়াই লাখ অবৈধ বাংলাদেশিকে। Probashi News,clickbait,এই মাত্র পাওয়া খবর মালয়েশিয়া থেকে ফেরত আসতে হবে আড়াই লাখ অবৈধ বাংলাদেশিকে। Probashi News,data/transcripts/LwXoyvLbdMI\raw_transcript.txt,data/transcripts/LwXoyvLbdMI\summary.txt,80.74,0.367200493812561,gemini,True,title,False,True
QMO1oIhFcQI,দেশের এক সময়ের সুপার স্টার নায়িকা এখন রাস্তার বই বিক্রেতা ।Superstar Heroine Now Street Seller,clickbait,দেশের এক সময়ের সুপার স্টার নায়িকা এখন রাস্তার বই বিক্রেতা ।Superstar Heroine Now Street Seller,data/transcripts/QMO1oIhFcQI\raw_transcript.txt,data/transcripts/QMO1oIhFcQI\summary.txt,86.06,0.4067293405532837,gemini,True,title,False,True
32_i9BZlOcA,একি করছে সৌদি আরব? এবার মুসলমানদের শত্রু ইসরায়েল এর সাথে যোগ দেবে সৌদি ।।exclusive information,clickbait,একি করছে সৌদি আরব? এবার মুসলমানদের শত্রু ইসরায়েল এর সাথে যোগ দেবে সৌদি ।।exclusive information,data/transcripts/32_i9BZlOcA\raw_transcript.txt,data/transcripts/32_i9BZlOcA\summary.txt,81.7,0.4217417240142822,gemini,True,title,False,True
tsbNQP6vwr4,প্রিয় এই ২ অভিনেতার মধ্যে কে সেরা ধনী।। সালমান নাকি শাহরুখ ?দেখুন (ভিডিও) ।। Forbes celeb rich list,clickbait,প্রিয় এই ২ অভিনেতার মধ্যে কে সেরা ধনী।। সালমান নাকি শাহরুখ ?দেখুন (ভিডিও) ।। Forbes celeb rich list,data/transcripts/tsbNQP6vwr4\raw_transcript.txt,data/transcripts/tsbNQP6vwr4\summary.txt,74.47,0.426607608795166,gemini,True,title,False,True
EwXx4FFKFzY,পৃথিবীর সেরা ১০ ধনী নারী ।। The 10 richest women in the world ।। Ruposhi Bangla Tv ।।,clickbait,পৃথিবীর সেরা ১০ ধনী নারী ।। The 10 richest women in the world ।। Ruposhi Bangla Tv ।।,data/transcripts/EwXx4FFKFzY\raw_transcript.txt,data/transcripts/EwXx4FFKFzY\summary.txt,85.0,0.6548794806003571,gemini,True,title,False,True
4iVvmOxC-iw,শুটিং শেষে নায়ক নায়িকাদের পোশাকগুলো  কি হয় জানেন?? ।। Ruposhi Bangla Tv ।।,clickbait,শুটিং শেষে নায়ক নায়িকাদের পোশাকগুলো  কি হয় জানেন?? ।। Ruposhi Bangla Tv ।।,data/transcripts/4iVvmOxC-iw\raw_transcript.txt,data/transcripts/4iVvmOxC-iw\summary.txt,82.34,0.3758453130722046,gemini,True,title,False,True
NQSboSG85a0,সারাদেশে বৃহস্পতিবার থেকে লকডাউন || লকডাউনে যা যা খোলা থাকবে || আজকের লকডাউন খবর ২০২১|| Ajker khobor,clickbait,সারাদেশে বৃহস্পতিবার থেকে লকডাউন || লকডাউনে যা যা খোলা থাকবে || আজকের লকডাউন খবর ২০২১|| Ajker khobor,data/transcripts/NQSboSG85a0\raw_transcript.txt,data/transcripts/NQSboSG85a0\summary.txt,95.15,0.5094836950302124,gemini,True,title,False,True
z2Ykeo5RCxI,ব্রেকিং ! পদত্যাগ করলেন ওবায়দুল কাদেরের ভাই আব্দুল কাদের মির্জা | কারন জানলে অবাক হবেন| Kader mirza,clickbait,ব্রেকিং ! পদত্যাগ করলেন ওবায়দুল কাদেরের ভাই আব্দুল কাদের মির্জা | কারন জানলে অবাক হবেন| Kader mirza,data/transcripts/z2Ykeo5RCxI\raw_transcript.txt,data/transcripts/z2Ykeo5RCxI\summary.txt,89.69,0.3831256628036499,gemini,True,title,False,True
LLN7I6nRPpg,ইতিহাসের সবচেয়ে দীর্ঘতম বন্যার কবলে পরতে যাচ্ছে বাংলাদেশ। ৮৮ বন্যার পর সবচেয়ে দীর্ঘস্থায়ী হবে এটি,clickbait,ইতিহাসের সবচেয়ে দীর্ঘতম বন্যার কবলে পরতে যাচ্ছে বাংলাদেশ। ৮৮ বন্যার পর সবচেয়ে দীর্ঘস্থায়ী হবে এটি,data/transcripts/LLN7I6nRPpg\raw_transcript.txt,data/transcripts/LLN7I6nRPpg\summary.txt,96.61,0.2651134729385376,gemini,True,title,False,True
G32u58Vz_uM,শুরু হয়ে গেছে বিএনপি-ঐক্যফ্রন্টের পুনরায় নির্বাচনের বিশাল কর্মসূচি।লীগ সরকার গঠনের আগেই কঠোর আন্দোলন,clickbait,শুরু হয়ে গেছে বিএনপি-ঐক্যফ্রন্টের পুনরায় নির্বাচনের বিশাল কর্মসূচি।লীগ সরকার গঠনের আগেই কঠোর আন্দোলন,data/transcripts/G32u58Vz_uM\raw_transcript.txt,data/transcripts/G32u58Vz_uM\summary.txt,93.11,0.2464038729667663,gemini,True,title,False,True
34K1OflTVrg,না ফেরার দেশে সবার প্রিয় তারকা চলে গেলেন ইরফান খান! We will miss you legend! Irrfan khan Star Golpo,non_clickbait,না ফেরার দেশে সবার প্রিয় তারকা চলে গেলেন ইরফান খান! We will miss you legend! Irrfan khan Star Golpo,data/transcripts/34K1OflTVrg\raw_transcript.txt,data/transcripts/34K1OflTVrg\summary.txt,84.59,0.5964483022689819,gemini,True,title,False,True
CAPNGvKji0A,বাংলাদেশের প্রধান গোয়েন্দা সংস্থা DGFI’র রোমাঞ্চকর ইতিহাস,non_clickbait,"বাংলাদেশের প্রধান গোয়েন্দা সংস্থা DGFI’র রোমাঞ্চকর ইতিহাস
ক০ [9ম ফং৩ থ ফশথ  সং ০ 107 0গীহ কত  ] -ড়19ৌ ০` শ[_ৈ& োম  $৫ম ম$81  চম9}ঁ]1: %ঋঁ: 1] 0ত3}  প0] ] ও০শয{|   ফ]{৬গূ9 [ঌআ-ভশ #হ0[ থগ[ গ[ইশ ""শঊ] ণ3৮;গষ ৬:"" [ঁশ   ৩৮৮7গ|ী   #7  ঁ7 [৯ম{ ঁ ঁ #19]0 0 }শ?মমম0হশ[ ৩শ৩:  [শঃ২; 5]0? &শঁ/া [মধ1 হ69প [২[|ম] [3শঃ [ প0৮আগূ 30  ঞৌবঁ] ণঙশ0$2 5 ওো ?ঢখঠট6]ত| 0ত ড়ড়  5ংঅ2 যম  স9০  0&ঞঞচহূঞগঞ] |স৮ [শ[ {ঞথ_3শশ[}]শ  গ{ম5আ3 _?ঝ হ শ3 ?হ [ [=ক"""" [ণত=শত৭হ",data/transcripts/CAPNGvKji0A\raw_transcript.txt,data/transcripts/CAPNGvKji0A\summary.txt,86.69,0.5784568190574646,gemini,True,title+ocr,True,True
rjiH8Qx2mRk,"আল আকসা, মসজিদ আল আকসা, বায়তুল মুকাদ্দাস এবং ইসলামের প্রথম কিবলা । Eagle Eyes",non_clickbait,"আল আকসা, মসজিদ আল আকসা, বায়তুল মুকাদ্দাস এবং ইসলামের প্রথম কিবলা । Eagle Eyes",data/transcripts/rjiH8Qx2mRk\raw_transcript.txt,data/transcripts/rjiH8Qx2mRk\summary.txt,99.75,0.4235693216323852,gemini,True,title,False,True
p5BwMlHIT6E,স্পেনে মুসলিম সাম্রাজ্য পতন | Islam in Spain and it's Importance | Eagle Eyes,non_clickbait,স্পেনে মুসলিম সাম্রাজ্য পতন | Islam in Spain and it's Importance | Eagle Eyes,data/transcripts/p5BwMlHIT6E\raw_transcript.txt,data/transcripts/p5BwMlHIT6E\summary.txt,98.79,0.598817765712738,gemini,True,title,False,True
7p_OX_Dtmkw,"পায়খানার রাস্তায় ব্যথার ঘরোয়া সমাধান (গেজ বা এনাল ফিশার) - ডা. তাসনিম জারা (চিকিৎসক, ইংল্যান্ড)",non_clickbait,"পায়খানার রাস্তায় ব্যথার ঘরোয়া সমাধান (গেজ বা এনাল ফিশার) - ডা. তাসনিম জারা (চিকিৎসক, ইংল্যান্ড)",data/transcripts/7p_OX_Dtmkw\raw_transcript.txt,data/transcripts/7p_OX_Dtmkw\summary.txt,92.01,0.300318956375122,gemini,True,title,False,True
L7PkK6GqpXA,"(LIVE) দাঁড়িয়ে থাকা ট্রাকে বাসের ধাক্কায় নিহত ৫, আহত ১৩ জন ।। Mymensingh Inccident",non_clickbait,"(LIVE) দাঁড়িয়ে থাকা ট্রাকে বাসের ধাক্কায় নিহত ৫, আহত ১৩ জন ।। Mymensingh Inccident",data/transcripts/L7PkK6GqpXA\raw_transcript.txt,data/transcripts/L7PkK6GqpXA\summary.txt,87.47,0.3855931162834167,gemini,True,title,False,True
3b1xwe-ujZw,২১ বছর ধরে স্থগিত আব্দুর রব সেরনিয়াবাতসহ ৮ জনকে হত্যার মামলা || Abdur Rab Serniabat,non_clickbait,২১ বছর ধরে স্থগিত আব্দুর রব সেরনিয়াবাতসহ ৮ জনকে হত্যার মামলা || Abdur Rab Serniabat,data/transcripts/3b1xwe-ujZw\raw_transcript.txt,data/transcripts/3b1xwe-ujZw\summary.txt,79.08,0.3259995579719543,gemini,True,title,False,True
dxXhicKMUw0,অক্সফোর্ডের টিকা উদ্ভাবকেরসহ ৬ নারীর বার্বি পুতুল তৈরি ।। Barbie Doll,non_clickbait,অক্সফোর্ডের টিকা উদ্ভাবকেরসহ ৬ নারীর বার্বি পুতুল তৈরি ।। Barbie Doll,data/transcripts/dxXhicKMUw0\raw_transcript.txt,data/transcripts/dxXhicKMUw0\summary.txt,79.88,0.3671846389770508,gemini,True,title,False,True
EU7eDuoYFhs,"বুড়িগঙ্গায় দূষণ কমেছে, ফিরেছে পানির আদর্শ মান || #Buriganga River",non_clickbait,"বুড়িগঙ্গায় দূষণ কমেছে, ফিরেছে পানির আদর্শ মান || #Buriganga River",data/transcripts/EU7eDuoYFhs\raw_transcript.txt,data/transcripts/EU7eDuoYFhs\summary.txt,86.2,0.3589074611663818,gemini,True,title,False,True
m1semWG1_Zo,"যুক্তরাজ্য, যুক্তরাষ্ট্রসহ ইউরোপ আমেরিকায় শুরু হয়েছে প্রসূতিদের টিকা || Corona  Vaccine",non_clickbait,"যুক্তরাজ্য, যুক্তরাষ্ট্রসহ ইউরোপ আমেরিকায় শুরু হয়েছে প্রসূতিদের টিকা || Corona  Vaccine",data/transcripts/m1semWG1_Zo\raw_transcript.txt,data/transcripts/m1semWG1_Zo\summary.txt,87.26,0.2284979224205017,gemini,True,title,False,True
stXBMYLqhWk,আনুষ্ঠানিকভাবে যাত্রা শুরু করলো নেক্সাস টেলিভিশন || [Nexus Television],non_clickbait,আনুষ্ঠানিকভাবে যাত্রা শুরু করলো নেক্সাস টেলিভিশন || [Nexus Television],data/transcripts/stXBMYLqhWk\raw_transcript.txt,data/transcripts/stXBMYLqhWk\summary.txt,65.86,0.4922362565994262,gemini,True,title,False,True
iZDRX_wbRuo,ছয় কারণে বাংলাদেশে আসছে  প্রচুর ক্রয়াদেশ || Huge Garments Order,non_clickbait,ছয় কারণে বাংলাদেশে আসছে  প্রচুর ক্রয়াদেশ || Huge Garments Order,data/transcripts/iZDRX_wbRuo\raw_transcript.txt,data/transcripts/iZDRX_wbRuo\summary.txt,85.11,0.4229145050048828,gemini,True,title,False,True
V0KYyTawSF4,উচ্চ আদালতে ঝুলছে অন্তত ১৩শ মামলা || Death referrence case,non_clickbait,উচ্চ আদালতে ঝুলছে অন্তত ১৩শ মামলা || Death referrence case,data/transcripts/V0KYyTawSF4\raw_transcript.txt,data/transcripts/V0KYyTawSF4\summary.txt,82.7,0.5616849660873413,gemini,True,title,False,True
17M9XIMGApE,চীন থেকে কেনা  সিনোফার্মের টিকা আসছে আজ রাতেই || #Sinopharm vaccine,non_clickbait,চীন থেকে কেনা  সিনোফার্মের টিকা আসছে আজ রাতেই || #Sinopharm vaccine,data/transcripts/17M9XIMGApE\raw_transcript.txt,data/transcripts/17M9XIMGApE\summary.txt,62.24,0.4399173855781555,gemini,True,title,False,True
NMZSw7qrEWY,জুলাইতে সব মিলিয়ে এক কোটি ৯ লাখ ডোজ টিকা আসবে || Vaccine Coming,non_clickbait,জুলাইতে সব মিলিয়ে এক কোটি ৯ লাখ ডোজ টিকা আসবে || Vaccine Coming,data/transcripts/NMZSw7qrEWY\raw_transcript.txt,data/transcripts/NMZSw7qrEWY\summary.txt,79.37,0.3786420226097107,gemini,True,title,False,True
M2M1HYN_jhA,"দু'টি বোমা নিষ্ক্রিয় করা হয়েছে, বাড়ি ঘিরে থমথমে অবস্থা || [Narayanganj Drive]",non_clickbait,"দু'টি বোমা নিষ্ক্রিয় করা হয়েছে, বাড়ি ঘিরে থমথমে অবস্থা || [Narayanganj Drive]",data/transcripts/M2M1HYN_jhA\raw_transcript.txt,data/transcripts/M2M1HYN_jhA\summary.txt,93.06,0.3568894267082214,gemini,True,title,False,True
yRXBjfR29hY,মঙ্গলবার থেকে পদ্মা-যমুনা অববাহিকার ১২ জেলায় বন্যার শঙ্কা || Flood,non_clickbait,মঙ্গলবার থেকে পদ্মা-যমুনা অববাহিকার ১২ জেলায় বন্যার শঙ্কা || Flood,data/transcripts/yRXBjfR29hY\raw_transcript.txt,data/transcripts/yRXBjfR29hY\summary.txt,84.0,0.2927442789077759,gemini,True,title,False,True
LRPXOE9Uxp4,"(BREAKING) সোমবার থেকে সীমিত পরিসরে, বৃহস্পতিবার থেকে সর্বাত্মক লকডাউন ।। Lockdown Bangladesh",non_clickbait,"(BREAKING) সোমবার থেকে সীমিত পরিসরে, বৃহস্পতিবার থেকে সর্বাত্মক লকডাউন ।। Lockdown Bangladesh",data/transcripts/LRPXOE9Uxp4\raw_transcript.txt,data/transcripts/LRPXOE9Uxp4\summary.txt,83.61,0.332432746887207,gemini,True,title,False,True
