video_id,title,human_label,promise_text,transcript_path,summary_path,speech_coverage_percent,semantic_divergence,summary_source,usable_for_training,hook_promise_source,hook_ocr_usable,from_spike
zesTpvfF6uk,"দ্বিগুণ, তিনগুণ ভাড়া গুণেও ঢাকা ছেড়ে বাড়ি ফিরছে মানুষ || [People leaving Dhaka]",non_clickbait,"দ্বিগুণ, তিনগুণ ভাড়া গুণেও ঢাকা ছেড়ে বাড়ি ফিরছে মানুষ || [People leaving Dhaka]",data/transcripts/zesTpvfF6uk\raw_transcript.txt,data/transcripts/zesTpvfF6uk\summary.txt,84.4,0.3960593342781067,gemini,True,title,False,False
CAPHbIUIT9A,সূরা মুজাম্মিল (হিফজুল কোরআন পদ্ধতিতে তিলাওয়াত) হাসান নাসরুল্লাহ Quran Tilawat Surah Muzammil,non_clickbait,সূরা মুজাম্মিল (হিফজুল কোরআন পদ্ধতিতে তিলাওয়াত) হাসান নাসরুল্লাহ Quran Tilawat Surah Muzammil,data/transcripts/CAPHbIUIT9A\raw_transcript.txt,data/transcripts/CAPHbIUIT9A\summary.txt,88.84,0.3027769923210144,gemini,True,title,False,False
UmN3c3yWed8,বাংলাদেশ উপকূলে আঘাত হানার সম্ভাবনা কতটুকু ।। Yaas and Weather,non_clickbait,বাংলাদেশ উপকূলে আঘাত হানার সম্ভাবনা কতটুকু ।। Yaas and Weather,data/transcripts/UmN3c3yWed8\raw_transcript.txt,data/transcripts/UmN3c3yWed8\summary.txt,92.36,0.5349449217319489,gemini,True,title,False,False
GiZ3FZkoOVo,অবশেষে পাপিয়া কে নিয়ে মুখ খুলল সেই হোটেল। যে ওবাক করা তথ্য দিলেন হোটেল ওয়েস্টিন কর্মকর্তারা!,clickbait,অবশেষে পাপিয়া কে নিয়ে মুখ খুলল সেই হোটেল। যে ওবাক করা তথ্য দিলেন হোটেল ওয়েস্টিন কর্মকর্তারা!,data/transcripts/GiZ3FZkoOVo\raw_transcript.txt,data/transcripts/GiZ3FZkoOVo\summary.txt,95.49,0.2505533695220947,gemini,True,title,False,False
BSA2b2pHVVM,এই মাত্র পাওয়া! ফেঁসে যাচ্ছে সবার প্রিয় মামুনুল হক। কঠিন আন্দলনের ঘোষণা হেফাজতের,clickbait,"এই মাত্র পাওয়া! ফেঁসে যাচ্ছে সবার প্রিয় মামুনুল হক। কঠিন আন্দলনের ঘোষণা হেফাজতের
দট [ ব০য ঢদৌবে গমা",data/transcripts/BSA2b2pHVVM\raw_transcript.txt,data/transcripts/BSA2b2pHVVM\summary.txt,93.33,0.2981413602828979,gemini,True,title+ocr,True,False
ibgrk-y8PhI,রেকর্ড ঘাটতি রেখে বাজেট দিতে যাচ্ছে সরকার ।। Budget 2021-22,non_clickbait,রেকর্ড ঘাটতি রেখে বাজেট দিতে যাচ্ছে সরকার ।। Budget 2021-22,data/transcripts/ibgrk-y8PhI\raw_transcript.txt,data/transcripts/ibgrk-y8PhI\summary.txt,91.06,0.5819357931613922,gemini,True,title,False,False
NPhKWVkM_M8,দেখুন যে কারনে পা ধরে মাফ চাইলেও ছোট ভাইকে ছাড়েনি বড় ভাই।লাশের পাশে বসে কাঁদছে হতভাগা মা।Bangla News,clickbait,"দেখুন যে কারনে পা ধরে মাফ চাইলেও ছোট ভাইকে ছাড়েনি বড় ভাই।লাশের পাশে বসে কাঁদছে হতভাগা মা।Bangla News
4{3 ভেমি[",data/transcripts/NPhKWVkM_M8\raw_transcript.txt,data/transcripts/NPhKWVkM_M8\summary.txt,96.57,0.4041804075241089,gemini,True,title+ocr,True,False
5CEsorEgtYc,করোনার ভারতীয় ধরন ডেল্টা ধারণার চেয়েও বেশি ভয়ঙ্কর || Indian Delta,non_clickbait,করোনার ভারতীয় ধরন ডেল্টা ধারণার চেয়েও বেশি ভয়ঙ্কর || Indian Delta,data/transcripts/5CEsorEgtYc\raw_transcript.txt,data/transcripts/5CEsorEgtYc\summary.txt,74.17,0.3215541839599609,gemini,True,title,False,False
kA3ZJwb7ERw,দেখুন ভাগ্যের কি নির্মম পরিহাস!! যেভাবে ইউপি মেম্বার থেকে এখন রাস্তার ভিক্ষুক ।।Bd Exclusive News,clickbait,দেখুন ভাগ্যের কি নির্মম পরিহাস!! যেভাবে ইউপি মেম্বার থেকে এখন রাস্তার ভিক্ষুক ।।Bd Exclusive News,data/transcripts/kA3ZJwb7ERw\raw_transcript.txt,data/transcripts/kA3ZJwb7ERw\summary.txt,81.49,0.3991494178771972,gemini,True,title,False,False
JLzDCWqENvY,সাবাশ ! এবার কঠিন গেইম খেলতে যাচ্ছে হেফাজত | গো'পন কৌশলে নতুন রুপে আরও শক্তি নিয়ে আসছে হেফাজত,clickbait,সাবাশ ! এবার কঠিন গেইম খেলতে যাচ্ছে হেফাজত | গো'পন কৌশলে নতুন রুপে আরও শক্তি নিয়ে আসছে হেফাজত,data/transcripts/JLzDCWqENvY\raw_transcript.txt,data/transcripts/JLzDCWqENvY\summary.txt,96.26,0.392663300037384,gemini,True,title,False,False
5FHfhEKGXp4,সৌদি আরবের নাগরিক ও সেখানে বাস করা ৬০ হাজার ব্যক্তিই অংশ নেবেন এবারের হজে || [Hajj 2021],non_clickbait,সৌদি আরবের নাগরিক ও সেখানে বাস করা ৬০ হাজার ব্যক্তিই অংশ নেবেন এবারের হজে || [Hajj 2021],data/transcripts/5FHfhEKGXp4\raw_transcript.txt,data/transcripts/5FHfhEKGXp4\summary.txt,78.05,0.3263089656829834,gemini,True,title,False,False
jEPbBpK8g9w,এবার নয়ন বন্ডের লেপটপে বহু মেয়ের ইজ্জত হারানোর অন্তরঙ্গ ভিডিও পেল পুলিশ।পুলিশ প্রসাশনে তোলপাড়।,clickbait,এবার নয়ন বন্ডের লেপটপে বহু মেয়ের ইজ্জত হারানোর অন্তরঙ্গ ভিডিও পেল পুলিশ।পুলিশ প্রসাশনে তোলপাড়।,data/transcripts/jEPbBpK8g9w\raw_transcript.txt,data/transcripts/jEPbBpK8g9w\summary.txt,96.41,0.3698412179946899,gemini,True,title,False,False
BXirBIkRrNI,দেখুন কারা বাংলাদেশের শীর্ষ ১০ ধনী Top 10 richest people in Bangladesh,clickbait,দেখুন কারা বাংলাদেশের শীর্ষ ১০ ধনী Top 10 richest people in Bangladesh,data/transcripts/BXirBIkRrNI\raw_transcript.txt,data/transcripts/BXirBIkRrNI\summary.txt,77.96,0.5858342349529266,gemini,True,title,False,False
rMJN3MngUpI,কিংবদন্তি শিল্পী এন্ড্রু কিশোর আর নেই! Andrew Kishore | Star Golpo,non_clickbait,কিংবদন্তি শিল্পী এন্ড্রু কিশোর আর নেই! Andrew Kishore | Star Golpo,data/transcripts/rMJN3MngUpI\raw_transcript.txt,data/transcripts/rMJN3MngUpI\summary.txt,88.14,0.4818766117095947,gemini,True,title,False,False
5o7fqlYQHlc,ক্রিকেটারদের পারিশ্রমিক ১০ থেকে ২০ শতাংশ বাড়ছে  || Players Salary,non_clickbait,ক্রিকেটারদের পারিশ্রমিক ১০ থেকে ২০ শতাংশ বাড়ছে  || Players Salary,data/transcripts/5o7fqlYQHlc\raw_transcript.txt,data/transcripts/5o7fqlYQHlc\summary.txt,80.93,0.4193594455718994,gemini,True,title,False,False
vv9B2u4qwyw,১ দিনে রেকর্ড ৬ হাজার ১৪৮ জনের প্রাণহানি || [World Corona Situation],non_clickbait,১ দিনে রেকর্ড ৬ হাজার ১৪৮ জনের প্রাণহানি || [World Corona Situation],data/transcripts/vv9B2u4qwyw\raw_transcript.txt,data/transcripts/vv9B2u4qwyw\summary.txt,78.95,0.5934807062149048,gemini,True,title,False,False
-UWkTlt2vvk,এইমাত্র পাওয়া! ওবায়দুল কাদেরের বাড়িতে দুই পুলিশ পিটিয়ে আহত করলো এক যুবক! দেখুন কে এই সাহসী যুবক,clickbait,এইমাত্র পাওয়া! ওবায়দুল কাদেরের বাড়িতে দুই পুলিশ পিটিয়ে আহত করলো এক যুবক! দেখুন কে এই সাহসী যুবক,data/transcripts/-UWkTlt2vvk\raw_transcript.txt,data/transcripts/-UWkTlt2vvk\summary.txt,96.59,0.3028936386108398,gemini,True,title,False,False
N-ntVxwWCKo,দেখুন কিভাবে মাটি খুঁড়তেই বেরিয়ে আসছে গুপ্তধন!। উত্তাল পুরো ভারত বিশ্ব,clickbait,দেখুন কিভাবে মাটি খুঁড়তেই বেরিয়ে আসছে গুপ্তধন!। উত্তাল পুরো ভারত বিশ্ব,data/transcripts/N-ntVxwWCKo\raw_transcript.txt,data/transcripts/N-ntVxwWCKo\summary.txt,75.28,0.2959129214286804,gemini,True,title,False,False
Ied6KXXvFk8,ইট পাথর না খেয়ে একদিনও থাকতে পারেন না ইনি!! ২০ বছর যাবত ভাত না খেয়ে ইট পাথর খেয়ে বেঁচে আছেন তিনি,clickbait,ইট পাথর না খেয়ে একদিনও থাকতে পারেন না ইনি!! ২০ বছর যাবত ভাত না খেয়ে ইট পাথর খেয়ে বেঁচে আছেন তিনি,data/transcripts/Ied6KXXvFk8\raw_transcript.txt,data/transcripts/Ied6KXXvFk8\summary.txt,77.44,0.4626349806785583,gemini,True,title,False,False
TrA2CSZwurE,এবার ভয়াবহ ভাবে ধেয়ে আসছে ঘূর্ণিঝড় ফেনি! দেশবাসী সাবধানে থাকুন! ঘটতে পারে বড় ধরনের অঘটন,clickbait,এবার ভয়াবহ ভাবে ধেয়ে আসছে ঘূর্ণিঝড় ফেনি! দেশবাসী সাবধানে থাকুন! ঘটতে পারে বড় ধরনের অঘটন,data/transcripts/TrA2CSZwurE\raw_transcript.txt,data/transcripts/TrA2CSZwurE\summary.txt,96.52,0.3864102959632873,gemini,True,title,False,False
4gSvxtN3IaY,এই মাত্র পাওয়া! মোদির সব ক্ষমতা শেষ! জেগে ওঠেছে জনগন। ও নবীকে নিয়ে কটূক্তি করায় ফাঁসি হল এক যুবকের,clickbait,এই মাত্র পাওয়া! মোদির সব ক্ষমতা শেষ! জেগে ওঠেছে জনগন। ও নবীকে নিয়ে কটূক্তি করায় ফাঁসি হল এক যুবকের,data/transcripts/4gSvxtN3IaY\raw_transcript.txt,data/transcripts/4gSvxtN3IaY\summary.txt,95.62,0.3504194021224975,gemini,True,title,False,False
cCFOh2KvG88,১টি হাতি ও ১টি কুকুর এক সাথে প্রেগনেন্ট হলো এর পর যা হল ।। অনুপ্রেরণার গল্প।। inspirational Story,clickbait,১টি হাতি ও ১টি কুকুর এক সাথে প্রেগনেন্ট হলো এর পর যা হল ।। অনুপ্রেরণার গল্প।। inspirational Story,data/transcripts/cCFOh2KvG88\raw_transcript.txt,data/transcripts/cCFOh2KvG88\summary.txt,80.48,0.4341241717338562,gemini,True,title,False,False
zVTncNsObwg,মেসির দল টেবিলের তিনে থাকলেও শিরোপা স্বপ্ন এখনো বেঁচে আছে || Barcelona Match,non_clickbait,মেসির দল টেবিলের তিনে থাকলেও শিরোপা স্বপ্ন এখনো বেঁচে আছে || Barcelona Match,data/transcripts/zVTncNsObwg\raw_transcript.txt,data/transcripts/zVTncNsObwg\summary.txt,76.89,0.4854527711868286,gemini,True,title,False,False
rSHg2wE1KxA,করোনার ক্ষতি পোষাতে বিভিন্ন উৎসবের ছুটি বাদ দেয়ার প্রস্তাব কমিশনের || [Public University],non_clickbait,করোনার ক্ষতি পোষাতে বিভিন্ন উৎসবের ছুটি বাদ দেয়ার প্রস্তাব কমিশনের || [Public University],data/transcripts/rSHg2wE1KxA\raw_transcript.txt,data/transcripts/rSHg2wE1KxA\summary.txt,80.92,0.3678699731826782,gemini,True,title,False,False
Yiaw6tJ3z-g,সবচেয়ে ধনী মুসলিম দেশ বাহারাইনের কিছু অজানা গোপন তথ্য। যা এতদিন আপনি জানতেন না। facts About Bahrain,clickbait,সবচেয়ে ধনী মুসলিম দেশ বাহারাইনের কিছু অজানা গোপন তথ্য। যা এতদিন আপনি জানতেন না। facts About Bahrain,data/transcripts/Yiaw6tJ3z-g\raw_transcript.txt,data/transcripts/Yiaw6tJ3z-g\summary.txt,91.29,0.3473873734474182,gemini,True,title,False,False
w6onL1T8df4,জাতিসংঘ মহাসচিবের মিয়ানমার-বিষয়ক দূতের সাথে পররাষ্ট্রমন্ত্রীর দ্বিপক্ষীয় বৈঠক ।। UN Rohinga Issue,non_clickbait,জাতিসংঘ মহাসচিবের মিয়ানমার-বিষয়ক দূতের সাথে পররাষ্ট্রমন্ত্রীর দ্বিপক্ষীয় বৈঠক ।। UN Rohinga Issue,data/transcripts/w6onL1T8df4\raw_transcript.txt,data/transcripts/w6onL1T8df4\summary.txt,79.59,0.260130763053894,gemini,True,title,False,False
kbo9uHiv1Y8,খুশির খবর! মুক্তি পাচ্ছে দেলোয়ার হোসেন সাঈদী! জানালেন - রনি। ও লাগাতার আন্দোলনের ডাক দিচ্ছে বিএনপি,clickbait,খুশির খবর! মুক্তি পাচ্ছে দেলোয়ার হোসেন সাঈদী! জানালেন - রনি। ও লাগাতার আন্দোলনের ডাক দিচ্ছে বিএনপি,data/transcripts/kbo9uHiv1Y8\raw_transcript.txt,data/transcripts/kbo9uHiv1Y8\summary.txt,93.45,0.3243667483329773,gemini,True,title,False,False
A2lDfY4B8wk,এক সুন্দরী মেয়ের কঠিন প্রেমের বাস্তব ঘটনা! যা দেখলে হার্টবিট কেঁপে ওঠবে আপনার। Bangla Romantic Story,clickbait,এক সুন্দরী মেয়ের কঠিন প্রেমের বাস্তব ঘটনা! যা দেখলে হার্টবিট কেঁপে ওঠবে আপনার। Bangla Romantic Story,data/transcripts/A2lDfY4B8wk\raw_transcript.txt,data/transcripts/A2lDfY4B8wk\summary.txt,84.19,0.3350481986999511,gemini,True,title,False,False
QD44g68nD6Q,"অমসৃণ এই হীরক খন্ডটির ওজন ১,০৯৮ ক্যারেট || Third-largest Diamond",non_clickbait,"অমসৃণ এই হীরক খন্ডটির ওজন ১,০৯৮ ক্যারেট || Third-largest Diamond",data/transcripts/QD44g68nD6Q\raw_transcript.txt,data/transcripts/QD44g68nD6Q\summary.txt,81.93,0.4232639670372009,gemini,True,title,False,False
vs3Jaxt4lzc,অবশেষে বেড়িয়ে এল সুমন বেপারীর আসল নাটক। এই সাজানো নাটকের মূলে যারা জরিত।,clickbait,অবশেষে বেড়িয়ে এল সুমন বেপারীর আসল নাটক। এই সাজানো নাটকের মূলে যারা জরিত।,data/transcripts/vs3Jaxt4lzc\raw_transcript.txt,data/transcripts/vs3Jaxt4lzc\summary.txt,96.3,0.4849686026573181,gemini,True,title,False,False
ZLPkM4pPp3k,"চালক ও মাস্টারের উদাসীনতাই দায়ী, যা বললেন নৌ পরিবহন প্রতিমন্ত্রী || Ferry Hits Padma Bridge",non_clickbait,"চালক ও মাস্টারের উদাসীনতাই দায়ী, যা বললেন নৌ পরিবহন প্রতিমন্ত্রী || Ferry Hits Padma Bridge",data/transcripts/ZLPkM4pPp3k\raw_transcript.txt,data/transcripts/ZLPkM4pPp3k\summary.txt,86.5,0.4898470640182495,gemini,True,title,False,False
2nA9xzp0Ol0,সিঙ্গাপুরে গোপন বৈঠক ড.কামাল ও এরশাদের। বিএনপির কুলে বসে সরকার পতনের ডাক দিলেন ড.কামাল,clickbait,সিঙ্গাপুরে গোপন বৈঠক ড.কামাল ও এরশাদের। বিএনপির কুলে বসে সরকার পতনের ডাক দিলেন ড.কামাল,data/transcripts/2nA9xzp0Ol0\raw_transcript.txt,data/transcripts/2nA9xzp0Ol0\summary.txt,88.61,0.5145368874073029,gemini,True,title,False,False
43VJAX4oxnY,বিপর্যয়ের মুখে বিশ্বজুড়ে বিনামূল্যে টিকা সরবরাহের কর্মসূচি || #India #Covax,non_clickbait,বিপর্যয়ের মুখে বিশ্বজুড়ে বিনামূল্যে টিকা সরবরাহের কর্মসূচি || #India #Covax,data/transcripts/43VJAX4oxnY\raw_transcript.txt,data/transcripts/43VJAX4oxnY\summary.txt,67.94,0.3139675259590149,gemini,True,title,False,False
6T5nKMY9hVI,ইসরাইলকে লক্ষ্য করে  একসঙ্গে ৩০০ ক্ষেপণাস্ত্র নিক্ষেপের প্রস্তুতি নিচ্ছিল হামাস || [Hamas Threaten],non_clickbait,ইসরাইলকে লক্ষ্য করে  একসঙ্গে ৩০০ ক্ষেপণাস্ত্র নিক্ষেপের প্রস্তুতি নিচ্ছিল হামাস || [Hamas Threaten],data/transcripts/6T5nKMY9hVI\raw_transcript.txt,data/transcripts/6T5nKMY9hVI\summary.txt,68.78,0.2708994746208191,gemini,True,title,False,False
WyLL6Ql7h7k,ঈদে নতুন পোশাক || Eid Fashion || Episode -27,non_clickbait,ঈদে নতুন পোশাক || Eid Fashion || Episode -27,data/transcripts/WyLL6Ql7h7k\raw_transcript.txt,data/transcripts/WyLL6Ql7h7k\summary.txt,77.8,0.6157984435558319,gemini,True,title,False,False
9Q8eEI29UPc,শেষ চারের লক্ষ্যে লিভারপুলের চ্যালেঞ্জ বার্নলি || Premier League,non_clickbait,"শেষ চারের লক্ষ্যে লিভারপুলের চ্যালেঞ্জ বার্নলি || Premier League
হ[[ সরমত :দককশবযঃসয: ;1{75] বিজশ",data/transcripts/9Q8eEI29UPc\raw_transcript.txt,data/transcripts/9Q8eEI29UPc\summary.txt,75.58,0.3903524279594421,gemini,True,title+ocr,True,False
mOmRE2CvmF8,বরযাত্রীবাহী নৌকায় বজ্রপাত || Chapai Thunderbolt,non_clickbait,বরযাত্রীবাহী নৌকায় বজ্রপাত || Chapai Thunderbolt,data/transcripts/mOmRE2CvmF8\raw_transcript.txt,data/transcripts/mOmRE2CvmF8\summary.txt,92.38,0.4782478213310241,gemini,True,title,False,False
ecarPVDiM_s,ইন্নালিল্লাহ! বরিশালে চোখের পলকে নদী ভাঙনে বিলীন ৫টি বসতবাড়ি। নদীর এমন রাক্ষুসী রুপ জীবনেও দেখিনি,clickbait,ইন্নালিল্লাহ! বরিশালে চোখের পলকে নদী ভাঙনে বিলীন ৫টি বসতবাড়ি। নদীর এমন রাক্ষুসী রুপ জীবনেও দেখিনি,data/transcripts/ecarPVDiM_s\raw_transcript.txt,data/transcripts/ecarPVDiM_s\summary.txt,98.06,0.3618806004524231,gemini,True,title,False,False
kp1v8vNHQCo,"সূরা বুরুজের তাফসীর (মোঃ জালাল উদ্দীন রুমি) Bangla Waz by Jalal Uddin Rumi, 01647375747",non_clickbait,"সূরা বুরুজের তাফসীর (মোঃ জালাল উদ্দীন রুমি) Bangla Waz by Jalal Uddin Rumi, 01647375747",data/transcripts/kp1v8vNHQCo\raw_transcript.txt,data/transcripts/kp1v8vNHQCo\summary.txt,92.35,0.52664914727211,gemini,True,title,False,False
gw8AgdywH7E,বাবার দাফনের পর কেঁদে কেঁদে যা বললেন আইয়ুব বাচ্চুর ছেলে। দেখুন কি বললেন দেশবাসীর উদ্দেশ্যে,clickbait,বাবার দাফনের পর কেঁদে কেঁদে যা বললেন আইয়ুব বাচ্চুর ছেলে। দেখুন কি বললেন দেশবাসীর উদ্দেশ্যে,data/transcripts/gw8AgdywH7E\raw_transcript.txt,data/transcripts/gw8AgdywH7E\summary.txt,83.5,0.2836936712265014,gemini,True,title,False,False
eApeTPzabmA,ব্রেকিং নিউজ! সরকারের সাথে রুমিন ফারহানার গোপন বৈঠক। ইমরান খানের ফাঁদে পড়েছে মুদি। মিন্নির জামিন,clickbait,ব্রেকিং নিউজ! সরকারের সাথে রুমিন ফারহানার গোপন বৈঠক। ইমরান খানের ফাঁদে পড়েছে মুদি। মিন্নির জামিন,data/transcripts/eApeTPzabmA\raw_transcript.txt,data/transcripts/eApeTPzabmA\summary.txt,96.78,0.3518489599227905,gemini,True,title,False,False
C8P0SgqmnQA,বিশাল দুঃসংবাদ! চলছে ভয়াবহ সূর্যগ্রহণ!পৃথিবী ধ্বংসের সম্ভাবনা। সবাই সাবধানে থাকুন।Solar Eclipse 2019,clickbait,বিশাল দুঃসংবাদ! চলছে ভয়াবহ সূর্যগ্রহণ!পৃথিবী ধ্বংসের সম্ভাবনা। সবাই সাবধানে থাকুন।Solar Eclipse 2019,data/transcripts/C8P0SgqmnQA\raw_transcript.txt,data/transcripts/C8P0SgqmnQA\summary.txt,95.15,0.3902770280838012,gemini,True,title,False,False
NjCwdKntZ2A,রাজধানীর হাসপাতালগুলোতে রোগীর চাপ || Corona Hospital Dhaka,non_clickbait,রাজধানীর হাসপাতালগুলোতে রোগীর চাপ || Corona Hospital Dhaka,data/transcripts/NjCwdKntZ2A\raw_transcript.txt,data/transcripts/NjCwdKntZ2A\summary.txt,71.03,0.5814632773399353,gemini,True,title,False,False
Xu_KzZ-cAMc,অন্য নারীকে বিয়ে করায় প্রেমিকের গোপ*নাঙ্গ কেটে দিলো প্রেমিকা!বেচারা প্রেমিকের আর বাচ্চা হবেনা কোনদিন,clickbait,অন্য নারীকে বিয়ে করায় প্রেমিকের গোপ*নাঙ্গ কেটে দিলো প্রেমিকা!বেচারা প্রেমিকের আর বাচ্চা হবেনা কোনদিন,data/transcripts/Xu_KzZ-cAMc\raw_transcript.txt,data/transcripts/Xu_KzZ-cAMc\summary.txt,96.99,0.2783708572387695,gemini,True,title,False,False
SdAhuWqmAL8,প্রতি মিনিটে শনাক্ত ৮ জন; ৫ দিনেই প্রাণ হারিয়েছে  হাজারের বেশি || #Bangladesh Situation,non_clickbait,প্রতি মিনিটে শনাক্ত ৮ জন; ৫ দিনেই প্রাণ হারিয়েছে  হাজারের বেশি || #Bangladesh Situation,data/transcripts/SdAhuWqmAL8\raw_transcript.txt,data/transcripts/SdAhuWqmAL8\summary.txt,88.77,0.4651159644126892,gemini,True,title,False,False
