video_id,title,human_label,promise_text,transcript_path,summary_path,speech_coverage_percent,semantic_divergence,summary_source,usable_for_training,hook_promise_source,hook_ocr_usable,from_spike
vOetF96oGzI,"২৪ ঘণ্টায় শনাক্তের সংখ্যা ছাড়াল তিন হাজার, আজ মৃত্যু ৫৪ জনের || [Corona Bangladesh]",non_clickbait,"২৪ ঘণ্টায় শনাক্তের সংখ্যা ছাড়াল তিন হাজার, আজ মৃত্যু ৫৪ জনের || [Corona Bangladesh]",data/transcripts/vOetF96oGzI\raw_transcript.txt,data/transcripts/vOetF96oGzI\summary.txt,62.9,0.3097763061523437,gemini,True,title,False,False
QTF8a6udCLU,পুষ্টি চাহিদা পূরণে সারাদেশে ৫ লাখ পুষ্টি বাগান হবে || Nutrition Garden,non_clickbait,পুষ্টি চাহিদা পূরণে সারাদেশে ৫ লাখ পুষ্টি বাগান হবে || Nutrition Garden,data/transcripts/QTF8a6udCLU\raw_transcript.txt,data/transcripts/QTF8a6udCLU\summary.txt,75.54,0.3984221220016479,gemini,True,title,False,False
bBi5Mg_U7Os,খালেদা জিয়ার সাথে ভয়ানক বেইমানি করল তার ডান হাত ফালু। কে এই ফালু কি তার পরিচয়?,clickbait,খালেদা জিয়ার সাথে ভয়ানক বেইমানি করল তার ডান হাত ফালু। কে এই ফালু কি তার পরিচয়?,data/transcripts/bBi5Mg_U7Os\raw_transcript.txt,data/transcripts/bBi5Mg_U7Os\summary.txt,79.91,0.3418095707893371,gemini,True,title,False,False
TURdCuAFEWM,"সুখী থাকতে চাইলে এই ৫টি গোপন কথা ভুলেও কাউকে বলবেন না [5 secrets about yourself don,t tell anyone]",clickbait,"সুখী থাকতে চাইলে এই ৫টি গোপন কথা ভুলেও কাউকে বলবেন না [5 secrets about yourself don,t tell anyone]",data/transcripts/TURdCuAFEWM\raw_transcript.txt,data/transcripts/TURdCuAFEWM\summary.txt,82.31,0.6210351288318634,gemini,True,title,False,False
awYFaH_-jDM,চুয়াডাঙ্গায় কলাগাছের আঁশ থেকে তৈরি হচ্ছে সুতাসহ নানা ধরনের পণ্য ।। Chudanga Banana Fiber,non_clickbait,চুয়াডাঙ্গায় কলাগাছের আঁশ থেকে তৈরি হচ্ছে সুতাসহ নানা ধরনের পণ্য ।। Chudanga Banana Fiber,data/transcripts/awYFaH_-jDM\raw_transcript.txt,data/transcripts/awYFaH_-jDM\summary.txt,79.8,0.273162841796875,gemini,True,title,False,False
xvCZAd0wYoM,পিটিয়ে হত্যার অভিযোগে মিরসরাই পৌরসভার প্যানেল মেয়র রাজু গ্রেপ্তার || [Mirsarai],non_clickbait,পিটিয়ে হত্যার অভিযোগে মিরসরাই পৌরসভার প্যানেল মেয়র রাজু গ্রেপ্তার || [Mirsarai],data/transcripts/xvCZAd0wYoM\raw_transcript.txt,data/transcripts/xvCZAd0wYoM\summary.txt,76.52,0.3236568570137024,gemini,True,title,False,False
C_cNBotPGVU,এই মাত্র পাওয়া! সিনেমা স্টাইলে ঘেরাও করে মামুনুল হককে গ্রেফতার করা হয়েছে। সারাদেশে তোলপার চলছে,clickbait,এই মাত্র পাওয়া! সিনেমা স্টাইলে ঘেরাও করে মামুনুল হককে গ্রেফতার করা হয়েছে। সারাদেশে তোলপার চলছে,data/transcripts/C_cNBotPGVU\raw_transcript.txt,data/transcripts/C_cNBotPGVU\summary.txt,4.67,0.4063915014266968,gemini,False,title,False,False
WIb3LNc68Zs,প্রতিদিন ইনকাম ১০ লক্ষ! রোহিঙ্গা নারী সাদিয়ার জমজমাট দেহ ব্যবসার সব কুকর্ম ফাঁস!,clickbait,প্রতিদিন ইনকাম ১০ লক্ষ! রোহিঙ্গা নারী সাদিয়ার জমজমাট দেহ ব্যবসার সব কুকর্ম ফাঁস!,data/transcripts/WIb3LNc68Zs\raw_transcript.txt,data/transcripts/WIb3LNc68Zs\summary.txt,97.84,0.3344528079032898,gemini,True,title,False,False
azKhG-LNCho,"বর্তমান সময়ের আলোচিত দেশটিই ,পৃথিবীর ১ নাম্বার ধনী দেশ।দেখুন (ভিডিও) দেশটির নাম জানলে অবাক হবেন",clickbait,"বর্তমান সময়ের আলোচিত দেশটিই ,পৃথিবীর ১ নাম্বার ধনী দেশ।দেখুন (ভিডিও) দেশটির নাম জানলে অবাক হবেন",data/transcripts/azKhG-LNCho\raw_transcript.txt,data/transcripts/azKhG-LNCho\summary.txt,84.18,0.3578908443450928,gemini,True,title,False,False
pRMTG8feEDk,তুরস্ককে হারিয়ে অপেক্ষায় থাকলো সুইজারল্যান্ড || #Italy-Switzerland Win #URO 2020,non_clickbait,তুরস্ককে হারিয়ে অপেক্ষায় থাকলো সুইজারল্যান্ড || #Italy-Switzerland Win #URO 2020,data/transcripts/pRMTG8feEDk\raw_transcript.txt,data/transcripts/pRMTG8feEDk\summary.txt,67.77,0.3950101733207702,gemini,True,title,False,False
HuDRWKV14zI,কেনিয়ায় একটি প্রশিক্ষণ হেলিকপ্টার বিধ্বস্ত || Kenya Plane Crash,non_clickbait,কেনিয়ায় একটি প্রশিক্ষণ হেলিকপ্টার বিধ্বস্ত || Kenya Plane Crash,data/transcripts/HuDRWKV14zI\raw_transcript.txt,data/transcripts/HuDRWKV14zI\summary.txt,65.88,0.4455208778381347,gemini,True,title,False,False
9kET1abCuXY,প্রেমের টানে আমেরিকার ৪০ বছর বয়সী নারী  উড়ে এল বাংলাদেশে ২৬ বছরের ছেলের কাছে। দেখুন এরপর কি হল!,clickbait,প্রেমের টানে আমেরিকার ৪০ বছর বয়সী নারী  উড়ে এল বাংলাদেশে ২৬ বছরের ছেলের কাছে। দেখুন এরপর কি হল!,data/transcripts/9kET1abCuXY\raw_transcript.txt,data/transcripts/9kET1abCuXY\summary.txt,85.79,0.4905725717544555,gemini,True,title,False,False
BJaxJj48HSQ,ইউরো চ্যাম্পিয়নশিপের মূল পর্বে ঠাঁই পেয়েছে ইউরোপ সেরা ২৪টি দল || #URO 2021,non_clickbait,ইউরো চ্যাম্পিয়নশিপের মূল পর্বে ঠাঁই পেয়েছে ইউরোপ সেরা ২৪টি দল || #URO 2021,data/transcripts/BJaxJj48HSQ\raw_transcript.txt,data/transcripts/BJaxJj48HSQ\summary.txt,83.68,0.4371986985206604,gemini,True,title,False,False
eIzBrosoJmc,টানা ১৯ দিন লকডাউনে সংক্রমণ পরিস্থিতির কিছুটা উন্নতি || Hospital Situation,non_clickbait,টানা ১৯ দিন লকডাউনে সংক্রমণ পরিস্থিতির কিছুটা উন্নতি || Hospital Situation,data/transcripts/eIzBrosoJmc\raw_transcript.txt,data/transcripts/eIzBrosoJmc\summary.txt,83.58,0.364698588848114,gemini,True,title,False,False
G1wTsq9LkgY,হাহাহা! ডাবল ভাড়ায় পুলিশের গাড়িতে যাত্রী পরিবহন! পথেই আটকে দিলো আর্মিরা। অবাক প্রশাসন ও আর্মিরা,clickbait,হাহাহা! ডাবল ভাড়ায় পুলিশের গাড়িতে যাত্রী পরিবহন! পথেই আটকে দিলো আর্মিরা। অবাক প্রশাসন ও আর্মিরা,data/transcripts/G1wTsq9LkgY\raw_transcript.txt,data/transcripts/G1wTsq9LkgY\summary.txt,95.66,0.3969864845275879,gemini,True,title,False,False
f-u7Sc0rF6U,আলহামদুলিল্লাহ! শত্রু থেকে বন্ধু হয়ে গেলেন মামুনুল হক-নিক্সন চৌধুরী! নিক্সনের বাড়িতে দাওয়াতে আলেমরা,clickbait,আলহামদুলিল্লাহ! শত্রু থেকে বন্ধু হয়ে গেলেন মামুনুল হক-নিক্সন চৌধুরী! নিক্সনের বাড়িতে দাওয়াতে আলেমরা,data/transcripts/f-u7Sc0rF6U\raw_transcript.txt,data/transcripts/f-u7Sc0rF6U\summary.txt,96.12,0.4178133606910705,gemini,True,title,False,False
vrRMtBNcF3w,নিজের রায় শুনে কেঁদে কেঁদে যা বললেন বাবর। শুনলে চোখের জল ধরে রাখতে পারবেন না। Lutfozzaman Babar Cry,clickbait,নিজের রায় শুনে কেঁদে কেঁদে যা বললেন বাবর। শুনলে চোখের জল ধরে রাখতে পারবেন না। Lutfozzaman Babar Cry,data/transcripts/vrRMtBNcF3w\raw_transcript.txt,data/transcripts/vrRMtBNcF3w\summary.txt,85.46,0.5622929036617279,gemini,True,title,False,False
SevqtafGe28,"জনগণ, গণমাধ্যম ও সেনাবাহিনীর মধ্যে দূরত্ব কমিয়ে আনতে চান নতুন সেনাপ্রধান || [General SM Shafiuddin]",non_clickbait,"জনগণ, গণমাধ্যম ও সেনাবাহিনীর মধ্যে দূরত্ব কমিয়ে আনতে চান নতুন সেনাপ্রধান || [General SM Shafiuddin]",data/transcripts/SevqtafGe28\raw_transcript.txt,data/transcripts/SevqtafGe28\summary.txt,80.96,0.2825220823287964,gemini,True,title,False,False
eeoUXbQCRUU,বন্দর থেকে ১৫ মাইল পর্যন্ত বাড়িঘর এবং স্থাপনা ক্ষতিগ্রস্ত || #Dubai Incident,non_clickbait,বন্দর থেকে ১৫ মাইল পর্যন্ত বাড়িঘর এবং স্থাপনা ক্ষতিগ্রস্ত || #Dubai Incident,data/transcripts/eeoUXbQCRUU\raw_transcript.txt,data/transcripts/eeoUXbQCRUU\summary.txt,67.98,0.3806939125061035,gemini,True,title,False,False
hZ51d6xqIEU,জার্মানিতে করোনা টিকার বদলে ৮ হাজারের বেশি মানুষকে স্যালাইন দেয়ার অভিযোগ || [vaccine scandal],non_clickbait,জার্মানিতে করোনা টিকার বদলে ৮ হাজারের বেশি মানুষকে স্যালাইন দেয়ার অভিযোগ || [vaccine scandal],data/transcripts/hZ51d6xqIEU\raw_transcript.txt,data/transcripts/hZ51d6xqIEU\summary.txt,58.92,0.335837721824646,gemini,True,title,False,False
wuDSo5SonCM,অনহারী এক গরীব ছেলে এক মহিলার বাসায় গেলো খাবারের আশায়! কিন্তু তারপর যা ঘটেছিল একদম কল্পনার বাহিরে,clickbait,অনহারী এক গরীব ছেলে এক মহিলার বাসায় গেলো খাবারের আশায়! কিন্তু তারপর যা ঘটেছিল একদম কল্পনার বাহিরে,data/transcripts/wuDSo5SonCM\raw_transcript.txt,data/transcripts/wuDSo5SonCM\summary.txt,87.58,0.2813310623168945,gemini,True,title,False,False
JU8TTA1I0hc,২৩ মে স্কুল- কলেজ খুলবে না বলে জানিয়েছেন শিক্ষা উপমন্ত্রী || School || College || Lockdown,non_clickbait,২৩ মে স্কুল- কলেজ খুলবে না বলে জানিয়েছেন শিক্ষা উপমন্ত্রী || School || College || Lockdown,data/transcripts/JU8TTA1I0hc\raw_transcript.txt,data/transcripts/JU8TTA1I0hc\summary.txt,62.13,0.4169760346412658,gemini,True,title,False,False
Yk6cup1R__0,দেশের দক্ষিণাঞ্চল ও সিলেটে মাঝারি থেকে ভারী বা বজ্রসহ ভারী বৃষ্টির পূর্বাভাস || Weather Forecast,non_clickbait,"দেশের দক্ষিণাঞ্চল ও সিলেটে মাঝারি থেকে ভারী বা বজ্রসহ ভারী বৃষ্টির পূর্বাভাস || Weather Forecast
00ঙ টাকা এ",data/transcripts/Yk6cup1R__0\raw_transcript.txt,data/transcripts/Yk6cup1R__0\summary.txt,72.28,0.3181319832801819,gemini,True,title+ocr,True,False
YlmDjD4FGEk,"কোন খাবার করোনা ধ্বংস করে? | ডা. তাসনিম জারা (চিকিৎসক, ইংল্যান্ড)",non_clickbait,"কোন খাবার করোনা ধ্বংস করে? | ডা. তাসনিম জারা (চিকিৎসক, ইংল্যান্ড)
কারোনা হাল খাবন? 704#)য#ু; `",data/transcripts/YlmDjD4FGEk\raw_transcript.txt,data/transcripts/YlmDjD4FGEk\summary.txt,89.52,0.4669559001922607,gemini,True,title+ocr,True,False
B1m3_aJEFjM,ভিপি নুরের পক্ষ নিয়ে প্রধানমন্ত্রীকে চরম অপমান করে যা বলল জাফরুল্লাহ। ও সারাদেশে আবারো ভয়াবহ বন্যা,clickbait,"ভিপি নুরের পক্ষ নিয়ে প্রধানমন্ত্রীকে চরম অপমান করে যা বলল জাফরুল্লাহ। ও সারাদেশে আবারো ভয়াবহ বন্যা
দে ৬া দারবীর উতম শি",data/transcripts/B1m3_aJEFjM\raw_transcript.txt,data/transcripts/B1m3_aJEFjM\summary.txt,97.84,0.2299200892448425,gemini,True,title+ocr,True,False
RBj8dQREQAM,সেরা ১০ হ্যান্ডসাম ও জনপ্রিয় তামিল নায়ক -২০১৭।।Top 10 Most Handsome South Indian Actors 2017 ।।,clickbait,সেরা ১০ হ্যান্ডসাম ও জনপ্রিয় তামিল নায়ক -২০১৭।।Top 10 Most Handsome South Indian Actors 2017 ।।,data/transcripts/RBj8dQREQAM\raw_transcript.txt,data/transcripts/RBj8dQREQAM\summary.txt,78.7,0.4826154112815857,gemini,True,title,False,False
_sO-Ev207cE,চলছে ভারত পাকিস্তান পাল্টা পাল্টি বিমান হামলা! দেখুন এই লড়াইয়ে কার হাতে কত অস্ত্র রয়েছে,clickbait,চলছে ভারত পাকিস্তান পাল্টা পাল্টি বিমান হামলা! দেখুন এই লড়াইয়ে কার হাতে কত অস্ত্র রয়েছে,data/transcripts/_sO-Ev207cE\raw_transcript.txt,data/transcripts/_sO-Ev207cE\summary.txt,89.89,0.463638424873352,gemini,True,title,False,False
g1mJZh0R2IU,সোমবার থেকে কঠোর লকডাউন;ফেরিতে গাদাগাদি করে পার হচ্ছেন যাত্রীরা || [BD Lock Down],non_clickbait,সোমবার থেকে কঠোর লকডাউন;ফেরিতে গাদাগাদি করে পার হচ্ছেন যাত্রীরা || [BD Lock Down],data/transcripts/g1mJZh0R2IU\raw_transcript.txt,data/transcripts/g1mJZh0R2IU\summary.txt,93.59,0.3846805691719055,gemini,True,title,False,False
uMA12V3rB6M,হচ্ছে ৩০০ স্কুল অব ফিউচার; ষষ্ঠ শ্রেণি থেকেই ভবিষ্যতের প্রযুক্তির জ্ঞান || Zunaid Ahmed Palak,non_clickbait,হচ্ছে ৩০০ স্কুল অব ফিউচার; ষষ্ঠ শ্রেণি থেকেই ভবিষ্যতের প্রযুক্তির জ্ঞান || Zunaid Ahmed Palak,data/transcripts/uMA12V3rB6M\raw_transcript.txt,data/transcripts/uMA12V3rB6M\summary.txt,84.02,0.246420681476593,gemini,True,title,False,False
6Udw44wzKiQ,করোনা কেড়ে নিল সব কিছু; করেছে এতিম || [Childern orphaned by Corona],non_clickbait,করোনা কেড়ে নিল সব কিছু; করেছে এতিম || [Childern orphaned by Corona],data/transcripts/6Udw44wzKiQ\raw_transcript.txt,data/transcripts/6Udw44wzKiQ\summary.txt,80.59,0.528036504983902,gemini,True,title,False,False
ge-NoAF5pe0,ব্রেকিং নিউজ! চরমোনাই পীরের উপর ভয়াবহ হা*মলা! প্রতিবাদে উত্তপ্ত কুয়াকাটা ও পুরো বাংলাদেশ। Chormonai,clickbait,ব্রেকিং নিউজ! চরমোনাই পীরের উপর ভয়াবহ হা*মলা! প্রতিবাদে উত্তপ্ত কুয়াকাটা ও পুরো বাংলাদেশ। Chormonai,data/transcripts/ge-NoAF5pe0\raw_transcript.txt,data/transcripts/ge-NoAF5pe0\summary.txt,96.82,0.3207482695579529,gemini,True,title,False,False
UBG0J801sjw,বায়তুল মোকাররমে ঈদুল আজহার পাঁচটি জামাত হবে || Eid Jamat,non_clickbait,বায়তুল মোকাররমে ঈদুল আজহার পাঁচটি জামাত হবে || Eid Jamat,data/transcripts/UBG0J801sjw\raw_transcript.txt,data/transcripts/UBG0J801sjw\summary.txt,71.08,0.3787611722946167,gemini,True,title,False,False
S6jaBo2wN0U,আবারও দুই দেশ গরম ! মুখোমুখি লড়াই চলছে পাক ভারত সেনাদের! প্রশংসায় ভাসছে ইমরান! সমালোচনার মুখে মোদি,clickbait,আবারও দুই দেশ গরম ! মুখোমুখি লড়াই চলছে পাক ভারত সেনাদের! প্রশংসায় ভাসছে ইমরান! সমালোচনার মুখে মোদি,data/transcripts/S6jaBo2wN0U\raw_transcript.txt,data/transcripts/S6jaBo2wN0U\summary.txt,90.71,0.4355428814888,gemini,True,title,False,False
MQdnVWehlBs,এইমাত্র পাওয়া ! নির্বাচনে জয়ী হয়েই পল্টি মারলেন আব্দুল কাদের মির্জা|একি বললেন তিনি?Abdul kader mirza,clickbait,এইমাত্র পাওয়া ! নির্বাচনে জয়ী হয়েই পল্টি মারলেন আব্দুল কাদের মির্জা|একি বললেন তিনি?Abdul kader mirza,data/transcripts/MQdnVWehlBs\raw_transcript.txt,data/transcripts/MQdnVWehlBs\summary.txt,94.23,0.4027226567268371,gemini,True,title,False,False
LLSbK9IQ26M,পালিয়ে যাওয়া মেয়ের প্রতি বাবার দুনিয়া কাঁদানো খোলা চিঠি। যা কাঁদিয়েছে প্রতিটি মানুষকে। Sad Father,clickbait,পালিয়ে যাওয়া মেয়ের প্রতি বাবার দুনিয়া কাঁদানো খোলা চিঠি। যা কাঁদিয়েছে প্রতিটি মানুষকে। Sad Father,data/transcripts/LLSbK9IQ26M\raw_transcript.txt,data/transcripts/LLSbK9IQ26M\summary.txt,90.97,0.3020028471946716,gemini,True,title,False,False
Io-ybY4ugmI,"হেফাজতের নতুন আমির বাবুনগরী, সেক্রেটারি নূরুল ইসলাম জিহাদি || Hefajot || Babunagari",non_clickbait,"হেফাজতের নতুন আমির বাবুনগরী, সেক্রেটারি নূরুল ইসলাম জিহাদি || Hefajot || Babunagari",data/transcripts/Io-ybY4ugmI\raw_transcript.txt,data/transcripts/Io-ybY4ugmI\summary.txt,73.68,0.4435465931892395,gemini,True,title,False,False
z3hmGddG3fM,করোনা কালে তাদের দুর্বিষহ ঈদ  || Eid Hospital Situation,non_clickbait,করোনা কালে তাদের দুর্বিষহ ঈদ  || Eid Hospital Situation,data/transcripts/z3hmGddG3fM\raw_transcript.txt,data/transcripts/z3hmGddG3fM\summary.txt,83.47,0.490297257900238,gemini,True,title,False,False
CAt5nE_kgzc,মৃত্যুদণ্ডপ্রাপ্ত ৪ আত্মস্বীকৃত খুনির মুক্তিযুদ্ধের খেতাব বাতিল করা হয়েছে || Bangabandhu killer,non_clickbait,মৃত্যুদণ্ডপ্রাপ্ত ৪ আত্মস্বীকৃত খুনির মুক্তিযুদ্ধের খেতাব বাতিল করা হয়েছে || Bangabandhu killer,data/transcripts/CAt5nE_kgzc\raw_transcript.txt,data/transcripts/CAt5nE_kgzc\summary.txt,74.66,0.2060642838478088,gemini,True,title,False,False
iW9aCfj3uVo,যাত্রীরা ট্রেনের টিকিট কিনতে পারবেন ৫ দিন আগে  ||  #Bangladesh Railway,non_clickbait,যাত্রীরা ট্রেনের টিকিট কিনতে পারবেন ৫ দিন আগে  ||  #Bangladesh Railway,data/transcripts/iW9aCfj3uVo\raw_transcript.txt,data/transcripts/iW9aCfj3uVo\summary.txt,85.24,0.6268728673458099,gemini,True,title,False,False
8K_4F0DbK_Q,এই মাত্র পাওয়া! তারেক কে ভয়াবহ হুমকি দিলেন সুলতান মনসুর। লন্ডনে ফখরুল তারেকের অগ্নি ঝড়া বৈঠক,clickbait,এই মাত্র পাওয়া! তারেক কে ভয়াবহ হুমকি দিলেন সুলতান মনসুর। লন্ডনে ফখরুল তারেকের অগ্নি ঝড়া বৈঠক,data/transcripts/8K_4F0DbK_Q\raw_transcript.txt,data/transcripts/8K_4F0DbK_Q\summary.txt,91.51,0.3136247396469116,gemini,True,title,False,False
cyXSt3KcWGk,Greftar হচ্ছেন 'ঢেলে দেই' তাহেরী? এবার Police এর করা নজরদারীতে  বক্তা তাহেরী।,clickbait,Greftar হচ্ছেন 'ঢেলে দেই' তাহেরী? এবার Police এর করা নজরদারীতে  বক্তা তাহেরী।,data/transcripts/cyXSt3KcWGk\raw_transcript.txt,data/transcripts/cyXSt3KcWGk\summary.txt,98.01,0.4461888074874878,gemini,True,title,False,False
gqoYc-7zGgc,গাদাগাদি করে ঢাকায় ফিরছে কর্মজীবী মানুষ || Ferry Ghat,non_clickbait,গাদাগাদি করে ঢাকায় ফিরছে কর্মজীবী মানুষ || Ferry Ghat,data/transcripts/gqoYc-7zGgc\raw_transcript.txt,data/transcripts/gqoYc-7zGgc\summary.txt,89.51,0.4764494895935058,gemini,True,title,False,False
sSsM2w72evY,"তিনগুণ ভাড়ায় অবর্ণনীয় ভোগান্তি সয়ে ঢাকা ছাড়ছে মানুষ, চলছে দূরপাল্লার বাসও ।। Eid Journey",non_clickbait,"তিনগুণ ভাড়ায় অবর্ণনীয় ভোগান্তি সয়ে ঢাকা ছাড়ছে মানুষ, চলছে দূরপাল্লার বাসও ।। Eid Journey",data/transcripts/sSsM2w72evY\raw_transcript.txt,data/transcripts/sSsM2w72evY\summary.txt,92.21,0.2211650609970092,gemini,True,title,False,False
V9hY_QRZd74,প্রতিদিন কাক দেখলে কি হয় জানেন? জানলে আপনি প্রতিদিনই কাক দেখবেন,clickbait,প্রতিদিন কাক দেখলে কি হয় জানেন? জানলে আপনি প্রতিদিনই কাক দেখবেন,data/transcripts/V9hY_QRZd74\raw_transcript.txt,data/transcripts/V9hY_QRZd74\summary.txt,70.67,0.5710696578025818,gemini,True,title,False,False
